,district_x,name,address_x,city,original_name_x,Match,simple_name,district_y,status,address_y,Score,,,
0,Centinela Valley,hawthorne-high,4859 West El Segundo Blvd.,Hawthorne,Hawthorne High,"[('hawthorne high', 100.0, 'hawthorne-high')]",hawthorne-high,Centinela Valley Union High,Active,4859 West El Segundo Blvd.,100,,,
1,Centinela Valley,lawndale-high,14901 S. Inglewood Avenue,Lawndale,Lawndale High,"[('lawndale high', 100.0, 'lawndale-high')]",lawndale-high,Centinela Valley Union High,Active,14901 South Inglewood Ave.,100,,,
2,Centinela Valley,lawndale-high,14901 S. Inglewood Avenue,Lawndale,Lawndale High,"[('lawndale high', 100.0, 'lawndale-high')]",lawndale-high,Los Angeles County Special Ed,Closed,14901 Inglewood Ave.,100,,,
3,Centinela Valley,leuzinger-high,4118 West Rosecrans Ave.,Lawndale,Leuzinger High,"[('leuzinger high', 100.0, 'leuzinger-high')]",leuzinger-high,Centinela Valley Union High,Active,4118 West Rosecrans Ave.,100,,,
4,Centinela Valley,r-k-lloyde-high,4951 Marine Ave.,Lawndale,R. K. Lloyde High,"[('r k lloyde high', 100.0, 'r-k-lloyde-high')]",r-k-lloyde-high,Centinela Valley Union High,Active,4951 Marine Ave.,100,,,
5,Charter,alliance-alice-m-baxter-college-ready-high-school,"461 9th Street, San Pedro",San Pedro,Alliance Alice M. Baxter College-Ready High School,"[('alliance alice m baxter college ready high', 95.0, 'alliance-alice-m-baxter-college-ready-high')]",alliance-alice-m-baxter-college-ready-high,,,,95,,,
6,Charter,alliance-cindy-and-bill-simon-technology-high-school,10720 Wilmington Avenue,Los Angeles,Alliance Cindy and Bill Simon Technology High School,"[('technology high', 90.0, 'technology-high')]",technology-high,,,,90,,,
7,Charter,alliance-college-ready-middle-academy-12,131 E. 50th Street,Los Angeles,Alliance College-Ready Middle Academy 12,"[('alliance college ready middle academy 12', 100.0, 'alliance-college-ready-middle-academy-12')]",alliance-college-ready-middle-academy-12,Los Angeles Unified,Active,131 East 50th St.,100,,,
8,Charter,alliance-college-ready-middle-academy-4,9719 S Main Street,Los Angeles,Alliance College-Ready Middle Academy 4,"[('alliance college ready middle academy 4', 100.0, 'alliance-college-ready-middle-academy-4')]",alliance-college-ready-middle-academy-4,Los Angeles Unified,Active,9719 South Main St.,100,,,
9,Charter,alliance-college-ready-middle-academy-5,211 South Avenue 20,Los Angeles,Alliance College-Ready Middle Academy 5,"[('alliance college ready middle academy 5', 100.0, 'alliance-college-ready-middle-academy-5')]",alliance-college-ready-middle-academy-5,Los Angeles Unified,Closed,211 South Avenue 20,100,,,
10,Charter,alliance-college-ready-middle-academy-8,113 S. Rowan Avenue,Los Angeles,Alliance College-Ready Middle Academy 8,"[('alliance college ready middle academy 8', 100.0, 'alliance-college-ready-middle-academy-8')]",alliance-college-ready-middle-academy-8,Los Angeles Unified,Active,113 South Rowan Ave.,100,,,
11,Charter,alliance-collins-family-college-ready-high-school,2071 Saturn Avenue,Huntington Park,Alliance Collins Family College-Ready High School,"[('alliance collins family college ready high', 95.0, 'alliance-collins-family-college-ready-high')]",alliance-collins-family-college-ready-high,,,,95,,,
12,Charter,alliance-dr-olga-mohan-high-school,644 West 17th Street,Los Angeles,Alliance Dr. Olga Mohan High School,"[('alliance dr olga mohan high', 95.0, 'alliance-dr-olga-mohan-high')]",alliance-dr-olga-mohan-high,,,,95,,,
13,Charter,alliance-gertz-ressler-richard-merkin-6-12-complex,2023 South Union Avenue,Los Angeles,Alliance Gertz-Ressler Richard Merkin 6-12 Complex,"[('alliance gertz ressler richard merkin 6 12 complex', 100.0, 'alliance-gertz-ressler-richard-merkin-6-12-complex')]",alliance-gertz-ressler-richard-merkin-6-12-complex,Los Angeles Unified,Active,2023 South Union Ave.,100,,,
14,Charter,alliance-gertz-ressler-richard-merkin-6-12-complex,2023 South Union Avenue,Los Angeles,Alliance Gertz-Ressler Richard Merkin 6-12 Complex,"[('alliance gertz ressler richard merkin 6 12 complex', 100.0, 'alliance-gertz-ressler-richard-merkin-6-12-complex')]",alliance-gertz-ressler-richard-merkin-6-12-complex,Los Angeles Unified,Active,2023 South Union Ave.,100,,,
15,Charter,alliance-jack-h-skirball-middle-school,603 E. 115th Street,Los Angeles,Alliance Jack H. Skirball Middle School,"[('alliance jack h skirball middle', 95.0, 'alliance-jack-h-skirball-middle')]",alliance-jack-h-skirball-middle,,,,95,,,
16,Charter,alliance-judy-ivie-burton-technology-academy-high-school,10101 S Broadway,Los Angeles,Alliance Judy Ivie Burton Technology Academy High School,"[('alliance judy ivie burton technology academy high', 95.0, 'alliance-judy-ivie-burton-technology-academy-high')]",alliance-judy-ivie-burton-technology-academy-high,,,,95,,,
17,Charter,alliance-kory-hunter-middle-school,5886 Compton Ave,Los Angeles,Alliance Kory Hunter Middle School,"[('alliance kory hunter middle', 95.0, 'alliance-kory-hunter-middle')]",alliance-kory-hunter-middle,,,,95,,,
18,Charter,alliance-leadership-middle-academy,2941 West 70th Street,Los Angeles,Alliance Leadership Middle Academy,[],,,,,,,,
19,Charter,alliance-leichtman-levine-family-foundation-environmental-science-high-school,2930 Fletcher Drive,Los Angeles,Alliance Leichtman-Levine Family Foundation Environmental Science High School,"[('alliance leichtman levine family foundation environmental science high', 95.23809523809523, 'alliance-leichtman-levine-family-foundation-environmental-science-high')]",alliance-leichtman-levine-family-foundation-environmental-science-high,,,,95.23809524,,,
20,Charter,alliance-marc-and-eva-stern-math-and-science-school,5151 State University Drive,Los Angeles,Alliance Marc and Eva Stern Math and Science School,"[('alliance marc   eva stern math and science', 95.0, 'alliance-marc-&-eva-stern-math-and-science')]",alliance-marc-&-eva-stern-math-and-science,,,,95,,,
21,Charter,alliance-margaret-m-bloomfield-technology-academy-high-school,7907 Santa Fe Ave,Huntington Park,Alliance Margaret M. Bloomfield Technology Academy High School,"[('alliance margaret m bloomfield technology academy high', 95.0, 'alliance-margaret-m-bloomfield-technology-academy-high')]",alliance-margaret-m-bloomfield-technology-academy-high,,,,95,,,
22,Charter,alliance-marine---innovation-and-technology-6-12-complex,11933 Allegheny Street,Sun Valley,Alliance Marine - Innovation and Technology 6-12 Complex,"[('alliance marine   innovation and technology 6 12 complex', 100.0, 'alliance-marine---innovation-and-technology-6-12-complex')]",alliance-marine---innovation-and-technology-6-12-complex,Los Angeles Unified,Active,11933 Allegheny St.,100,,,
23,Charter,alliance-marine---innovation-and-technology-6-12-complex,11933 Allegheny Street,Sun Valley,Alliance Marine - Innovation and Technology 6-12 Complex,"[('alliance marine   innovation and technology 6 12 complex', 100.0, 'alliance-marine---innovation-and-technology-6-12-complex')]",alliance-marine---innovation-and-technology-6-12-complex,Los Angeles Unified,Active,11933 Allegheny St.,100,,,
24,Charter,alliance-morgan-mckinzie-high-school,110 S. Townsend Ave.,Los Angeles,Alliance Morgan McKinzie High School,"[('alliance morgan mckinzie high', 95.0, 'alliance-morgan-mckinzie-high')]",alliance-morgan-mckinzie-high,,,,95,,,
25,Charter,alliance-ouchi-o'donovan-6-12-complex,5355 4th Avenue,Los Angeles,Alliance Ouchi-O'Donovan 6-12 Complex,"[('alliance ouchi o donovan 6 12 complex', 100.0, ""alliance-ouchi-o'donovan-6-12-complex"")]",alliance-ouchi-o'donovan-6-12-complex,Los Angeles Unified,Active,5356 South Fifth Ave.,100,,,
26,Charter,alliance-ouchi-o'donovan-6-12-complex,5356 South 5th Avenue,Los Angeles,Alliance Ouchi-O'Donovan 6-12 Complex,"[('alliance ouchi o donovan 6 12 complex', 100.0, ""alliance-ouchi-o'donovan-6-12-complex"")]",alliance-ouchi-o'donovan-6-12-complex,Los Angeles Unified,Active,5356 South Fifth Ave.,100,,,
27,Charter,alliance-patti-&-peter-neuwirth-leadership-academy,4610 S. Main Street,Los Angeles,Alliance Patti & Peter Neuwirth Leadership Academy,"[('alliance patti and peter neuwirth leadership academy', 96.07843137254902, 'alliance-patti-and-peter-neuwirth-leadership-academy')]",alliance-patti-and-peter-neuwirth-leadership-academy,,,,96.07843137,,,
28,Charter,alliance-piera-barbaglia-shaheen-health-services-academy,New: 8515 Kansas Avenue,Los Angeles,Alliance Piera Barbaglia Shaheen Health Services Academy,"[('alliance piera barbaglia shaheen health services academy', 100.0, 'alliance-piera-barbaglia-shaheen-health-services-academy')]",alliance-piera-barbaglia-shaheen-health-services-academy,Los Angeles Unified,Active,8515 Kansas Ave.,100,,,
29,Charter,alliance-renee-&-meyer-luskin-academy-high-school,2941 West 70th Street,Los Angeles,Alliance Renee & Meyer Luskin Academy High School,"[('alliance renee and meyer luskin academy high', 90.47619047619048, 'alliance-renee-and-meyer-luskin-academy-high')]",alliance-renee-and-meyer-luskin-academy-high,,,,90.47619048,,,
30,Charter,alliance-susan-and-eric-smidt-technology-high-school,211 South Avenue 20,Los Angeles,Alliance Susan and Eric Smidt Technology High School,"[('alliance susan and eric smidt technology high', 95.0, 'alliance-susan-and-eric-smidt-technology-high')]",alliance-susan-and-eric-smidt-technology-high,,,,95,,,
31,Charter,alliance-ted-k-tajima-high-school,"1552 Rockwood St, Los Angeles",Los Angeles,Alliance Ted K. Tajima High School,"[('alliance ted k tajima high', 95.0, 'alliance-ted-k-tajima-high')]",alliance-ted-k-tajima-high,,,,95,,,
32,Charter,alliance-tennenbaum-family-technology-high-school,2050 N. San Fernando Road,Los Angeles,Alliance Tennenbaum Family Technology High School,"[('alliance tennenbaum family technology high', 95.0, 'alliance-tennenbaum-family-technology-high')]",alliance-tennenbaum-family-technology-high,,,,95,,,
33,Charter,animo-city-of-champions,9330 S. 8th Ave.,Los Angeles,Animo City of Champions,"[('animo city of champions charter high', 90.0, 'animo-city-of-champions-charter-high')]",animo-city-of-champions-charter-high,,,,90,,,
34,Charter,animo-compton-charter-school,13305 S. San Pedro St.,Los Angeles,Animo Compton Charter School,"[('animo compton charter', 95.0, 'animo-compton-charter')]",animo-compton-charter,,,,95,,,
35,Charter,animo-ellen-ochoa,4360 Dozier St.,Los Angeles,Animo Ellen Ochoa,"[('animo ellen ochoa charter middle', 90.0, 'animo-ellen-ochoa-charter-middle')]",animo-ellen-ochoa-charter-middle,,,,90,,,
36,Charter,animo-florence-firestone,155 W. 69th St.,Los Angeles,Animo Florence Firestone,"[('animo florence firestone charter middle', 90.0, 'animo-florence-firestone-charter-middle')]",animo-florence-firestone-charter-middle,,,,90,,,
37,Charter,animo-inglewood,3425 Manchester Blvd.,Inglewood,Animo Inglewood,"[('animo inglewood charter high', 90.0, 'animo-inglewood-charter-high')]",animo-inglewood-charter-high,,,,90,,,
38,Charter,animo-jackie-robinson,3500 S. Hill St.,Los Angeles,Animo Jackie Robinson,"[('animo jackie robinson high', 95.0, 'animo-jackie-robinson-high')]",animo-jackie-robinson-high,,,,95,,,
39,Charter,animo-james-b-taylor,810-820 E. 111th Place,Los Angeles,Animo James B. Taylor,"[('animo james b taylor charter middle', 90.0, 'animo-james-b-taylor-charter-middle')]",animo-james-b-taylor-charter-middle,,,,90,,,
40,Charter,animo-jefferson,1655 E. 27th Street,Los Angeles,Animo Jefferson,"[('jefferson', 90.0, 'jefferson')]",jefferson,,,,90,,,
41,Charter,animo-leadership,11044 S. Freeman Ave.,Los Angeles,Animo Leadership,"[('animo leadership high', 95.0, 'animo-leadership-high')]",animo-leadership-high,,,,95,,,
42,Charter,animo-legacy,12226 S Western Ave.,Los Angeles,Animo Legacy,"[('legacy', 90.0, 'legacy')]",legacy,,,,90,,,
43,Charter,animo-locke,325 E 111th St.,Los Angeles,Animo Locke,"[('animo locke ace academy', 90.0, 'animo-locke-ace-academy')]",animo-locke-ace-academy,,,,90,,,
44,Charter,animo-mae-jemison,12700 Avalon Blvd.,Los Angeles,Animo Mae Jemison,"[('animo mae jemison charter middle', 90.0, 'animo-mae-jemison-charter-middle')]",animo-mae-jemison-charter-middle,,,,90,,,
45,Charter,animo-oscar-de-la-hoya,1114 S. Lorena Street,Los Angeles,Animo Oscar De La Hoya,[],,,,,,,,
46,Charter,animo-pat-brown,8255 Beach Street,Los Angeles,Animo Pat Brown,"[('animo pat brown', 100.0, 'animo-pat-brown')]",animo-pat-brown,Los Angeles Unified,Active,8255 Beach St.,100,,,
47,Charter,animo-ralph-bunche,1655 E. 27th Street,Los Angeles,Animo Ralph Bunche,"[('animo ralph bunche charter high', 90.0, 'animo-ralph-bunche-charter-high')]",animo-ralph-bunche-charter-high,,,,90,,,
48,Charter,animo-south-los-angeles,11130 Western Avenue,Los Angeles,Animo South Los Angeles,"[('animo south los angeles charter', 95.0, 'animo-south-los-angeles-charter')]",animo-south-los-angeles-charter,,,,95,,,
49,Charter,animo-venice,820 Broadway Street,Venice,Animo Venice,"[('animo venice charter high', 90.0, 'animo-venice-charter-high')]",animo-venice-charter-high,,,,90,,,
50,Charter,animo-watts,12628 Avalon Blvd.,Los Angeles,Animo Watts,"[('animo watts college preparatory academy', 90.0, 'animo-watts-college-preparatory-academy')]",animo-watts-college-preparatory-academy,,,,90,,,
51,Charter,animo-westside,5456 McConnell Ave.,Los Angeles,Animo Westside,"[('animo westside charter middle', 90.0, 'animo-westside-charter-middle')]",animo-westside-charter-middle,,,,90,,,
52,Charter,apex-academy,"1309 N Wilton Place, 3rd Floor",Los Angeles,APEX Academy,"[('apex academy', 100.0, 'apex-academy')]",apex-academy,Los Angeles Unified,Active,"1309 North Wilton Pl., 3rd Fl.",100,,,
53,Charter,arts-in-action-charter-(east-la),"1241 S Soto St., Ste. 212",Los Angeles,Arts in Action Charter (East LA),[],,,,,,,,
54,Charter,aspire-antonio-maria-lugo-academy,6100 Carmelita Avenue,Huntington Park,Aspire Antonio Maria Lugo Academy,"[('aspire antonio maria lugo academy', 100.0, 'aspire-antonio-maria-lugo-academy')]",aspire-antonio-maria-lugo-academy,Los Angeles County Office of Education,Active,6100 Carmelita Ave.,100,,,
55,Charter,aspire-centennial-college-preparatory-academy,2079 Saturn Ave,Huntington Park,Aspire Centennial College Preparatory Academy,"[('aspire centennial college preparatory academy', 100.0, 'aspire-centennial-college-preparatory-academy')]",aspire-centennial-college-preparatory-academy,Los Angeles Unified,Active,2079 Saturn Ave.,100,,,
56,Charter,aspire-firestone-academy,8929 Kauffman Ave,South Gate,Aspire Firestone Academy,"[('aspire firestone academy charter', 95.0, 'aspire-firestone-academy-charter')]",aspire-firestone-academy-charter,,,,95,,,
57,Charter,aspire-gateway-charter-academy,8929 Kauffman Ave,South Gate,Aspire Gateway Charter Academy,"[('aspire gateway academy charter', 95.0, 'aspire-gateway-academy-charter')]",aspire-gateway-academy-charter,,,,95,,,
58,Charter,aspire-inskeep-academy-charter,123 W 59th St,Los Angeles,Aspire Inskeep Academy Charter,"[('aspire inskeep academy charter', 100.0, 'aspire-inskeep-academy-charter')]",aspire-inskeep-academy-charter,Los Angeles Unified,Active,123 West 59th St.,100,,,
59,Charter,aspire-junior-collegiate-academy,6724 S Alameda St,Huntington Park,Aspire Junior Collegiate Academy,"[('aspire junior collegiate academy', 100.0, 'aspire-junior-collegiate-academy')]",aspire-junior-collegiate-academy,Los Angeles Unified,Active,6724 South Alameda St.,100,,,
60,Charter,aspire-ollin-university-preparatory-academy,2540 East 58th Street,Huntington Park,Aspire Ollin University Preparatory Academy,"[('aspire ollin university preparatory academy', 100.0, 'aspire-ollin-university-preparatory-academy')]",aspire-ollin-university-preparatory-academy,Los Angeles County Office of Education,Active,2540 East 58th St.,100,,,
61,Charter,aspire-pacific-academy,2565 58th St,Huntington Park,Aspire Pacific Academy,"[('aspire pacific academy', 100.0, 'aspire-pacific-academy')]",aspire-pacific-academy,Los Angeles Unified,Active,2565 58th St.,100,,,
62,Charter,aspire-slauson-academy-elementary,123 W 59th St,Los Angeles,Aspire Slauson Academy Elementary,[],,,,,,,,
63,Charter,aspire-juanita-tate-academy-elementary,123 W 59th St,Los Angeles,Aspire Juanita Tate Academy Elementary,[],,,,,,,,
64,Charter,aspire-titan-academy,6720 S Alameda St,Huntington Park,Aspire Titan Academy,"[('aspire titan academy', 100.0, 'aspire-titan-academy')]",aspire-titan-academy,Los Angeles Unified,Active,6720 South Alameda St.,100,,,
65,Charter,birmingham-community-high-school,17000 Haynes Street,Lake Balboa,Birmingham Community High School,"[('unity high', 90.0, 'unity-high')]",unity-high,,,,90,,,
66,Charter,california-school-of-the-arts---san-gabriel-valley,1401 Highland Avenue,Duarte,California School of the Arts - San Gabriel Valley,"[('california school of the arts   san gabriel valley', 100.0, 'california-school-of-the-arts---san-gabriel-valley')]",california-school-of-the-arts---san-gabriel-valley,Duarte Unified,Active,1401 Highland Ave.,100,,,
67,Charter,camino-nuevo-dalzell-lance-high-school,3500 West Temple Street,Los Angeles,Camino Nuevo Dalzell Lance High School,[],,,,,,,,
68,Charter,champs-charter-high-school-of-the-arts,6842 Van Nuys Blvd (5th Floor),Van Nuys,CHAMPS Charter High School of the Arts,[],,,,,,,,
69,Charter,conservation-corps-of-long-beach,340 Nieto Avenue,Long Beach,Conservation Corps of Long Beach,"[('conservation corps of long beach gateway cities charter', 90.0, 'conservation-corps-of-long-beach-gateway-cities-charter')]",conservation-corps-of-long-beach-gateway-cities-charter,,,,90,,,
70,Charter,davinci-rise-high-school-(charter),201 N. Douglas St.,El Segundo,DaVinci RISE High School (Charter),"[('rise high', 90.0, 'rise-high')]",rise-high,,,,90,,,
71,Charter,ednovate--esperanza-college-prep,319 N Humphreys Ave,Los Angeles,Ednovate- Esperanza College Prep,"[('ednovate   esperanza college prep', 98.46153846153847, 'ednovate---esperanza-college-prep')]",ednovate---esperanza-college-prep,,,,98.46153846,,,
72,Charter,ednovate-east-college-prep,3825 N Mission Rd,Los Angeles,Ednovate-East College Prep,"[('ednovate   east college prep', 96.2962962962963, 'ednovate---east-college-prep')]",ednovate---east-college-prep,,,,96.2962963,,,
73,Charter,ednovate---usc-hybrid-high-college-prep,3939 S Vermont Ave,Los Angeles,Ednovate - USC Hybrid High College Prep,"[('ednovate   usc hybrid high college prep', 100.0, 'ednovate---usc-hybrid-high-college-prep')]",ednovate---usc-hybrid-high-college-prep,Los Angeles Unified,Active,3939 S. Vermont Ave.,100,,,
74,Charter,ednovate-brio-college-prep,350 S Figueroa St Ste 100,Los Angeles,Ednovate-Brio College Prep,"[('ednovate   brio college prep', 96.2962962962963, 'ednovate---brio-college-prep')]",ednovate---brio-college-prep,,,,96.2962963,,,
75,Charter,ednovate---south-la-college-prep,700 Wilshire Bl Ste 400,Los Angeles,Ednovate - South LA College Prep,"[('ednovate   south la college prep', 100.0, 'ednovate---south-la-college-prep')]",ednovate---south-la-college-prep,Los Angeles Unified,Active,700 Wilshire Blvd. Ste. 400,100,,,
76,Charter,el-camino-real-charter-high-school,5440 Valley Circle Blvd.,Woodland Hills,El Camino Real Charter High School,"[('camino real high school', 95.0, 'camino-real-high-school')]",camino-real-high-school,,,,95,,,
77,Charter,environmental-charter-high-school--–-gardena-(echs-g),2818 Manhattan Beach Blvd,Gardena,Environmental Charter High School  – Gardena (ECHS-G),"[('environmental charter high   gardena', 95.0, 'environmental-charter-high---gardena')]",environmental-charter-high---gardena,,,,95,,,
78,Charter,environmental-charter-high-school-–-lawndale-(echs-l),16315 Grevillea Avenue ,Lawndale,Environmental Charter High School – Lawndale (ECHS-L),"[('environmental charter high   lawndale', 95.0, 'environmental-charter-high---lawndale')]",environmental-charter-high---lawndale,,,,95,,,
79,Charter,environmental-charter-middle-school-–-gardena-(ecms-g),812 W. 165th Place,Gardena,Environmental Charter Middle School – Gardena (ECMS-G),"[('environmental charter middle', 90.0, 'environmental-charter-middle')]",environmental-charter-middle,,,,90,,,
80,Charter,environmental-charter-middle-school-–-inglewood-(ecms-i),3600 W. Imperial Highway,Inglewood,Environmental Charter Middle School – Inglewood (ECMS-I),"[('environmental charter middle   inglewood', 95.0, 'environmental-charter-middle---inglewood')]",environmental-charter-middle---inglewood,,,,95,,,
81,Charter,gabriella-charter-schools-#1,11435 Logan Street,Los Angeles,Gabriella Charter Schools #1,"[('gabriella charter', 90.0, 'gabriella-charter')]",gabriella-charter,,,,90,,,
82,Charter,gabriella-charter-schools-#2,3736 Trinity Street,Los Angeles,Gabriella Charter Schools #2,"[('gabriella charter 2', 95.0, 'gabriella-charter-2')]",gabriella-charter-2,,,,95,,,
83,Charter,icef-inglewood-elementary-charter-academy,434 S. Grevillea Ave.,Inglewood,ICEF Inglewood Elementary Charter Academy,"[('icef inglewood elementary charter academy', 100.0, 'icef-inglewood-elementary-charter-academy')]",icef-inglewood-elementary-charter-academy,Inglewood Unified,Active,434 South Grevillea Ave.,100,,,
84,Charter,icef-innovation-los-angeles-elementary,5029 S. Vermont Ave,Los Angeles,ICEF Innovation Los Angeles Elementary,"[('los angeles elementary', 90.0, 'los-angeles-elementary')]",los-angeles-elementary,,,,90,,,
85,Charter,icef-view-park-preparatory-elementary-school,5311 S. Crenshaw Blvd.,Los Angeles,ICEF View Park Preparatory Elementary School,"[('icef view park preparatory elementary', 95.0, 'icef-view-park-preparatory-elementary')]",icef-view-park-preparatory-elementary,,,,95,,,
86,Charter,icef-view-park-preparatory-high-school,5701 S. Crenshaw Blvd,Los Angeles,ICEF View Park Preparatory High School,"[('icef view park preparatory high', 95.0, 'icef-view-park-preparatory-high')]",icef-view-park-preparatory-high,,,,95,,,
87,Charter,icef-view-park-preparatory-middle-school,5311 S. Crenshaw Blvd.,Los Angeles,ICEF View Park Preparatory Middle School,"[('icef view park preparatory middle', 95.0, 'icef-view-park-preparatory-middle')]",icef-view-park-preparatory-middle,,,,95,,,
88,Charter,icef-vista-elementary-charter-academy,4471 Inglewood Blvd,Los Angeles,ICEF Vista Elementary Charter Academy,"[('icef vista elementary academy', 95.0, 'icef-vista-elementary-academy')]",icef-vista-elementary-academy,,,,95,,,
89,Charter,icef-vista-middle-charter-academy,4471 Inglewood Blvd,Los Angeles,ICEF Vista Middle Charter Academy,"[('icef vista middle academy', 95.0, 'icef-vista-middle-academy')]",icef-vista-middle-academy,,,,95,,,
90,Charter,intellectual-virtues-academy-of-long-beach-,1637 Long Beach Blvd.,Long Beach,Intellectual Virtues Academy of Long Beach ,"[('intellectual virtues academy of long beach', 100.0, 'intellectual-virtues-academy-of-long-beach')]",intellectual-virtues-academy-of-long-beach,,,,100,,,
91,Charter,larchmont-charter-school,"444 N. LARCHMONT BLVD., SUITE 207",Los Angeles,Larchmont Charter School,"[('larchmont charter', 95.0, 'larchmont-charter')]",larchmont-charter,,,,95,,,
92,Charter,libertas-college-preparatory-charter-school,5101 S. Western Avenue,Los Angeles,Libertas College Preparatory Charter School,"[('libertas college preparatory charter', 95.0, 'libertas-college-preparatory-charter')]",libertas-college-preparatory-charter,,,,95,,,
93,Charter,los-angeles-academy-of-arts-and-enterprise-(laaae),1200 Colton St.,Los Angeles,Los Angeles Academy of Arts and Enterprise (LAAAE),"[('los angeles academy of arts and enterprise', 95.0, 'los-angeles-academy-of-arts-and-enterprise')]",los-angeles-academy-of-arts-and-enterprise,,,,95,,,
94,Charter,matrix-academy-for-success,1010 E 34th St.,Los Angeles,Matrix Academy for Success,"[('matrix for success academy', 95.0, 'matrix-for-success-academy')]",matrix-for-success-academy,,,,95,,,
95,Charter,new-designs-charter-school,1342 W. Adams Blvd.,Los Angeles,New Designs Charter School,"[('new designs charter', 95.0, 'new-designs-charter')]",new-designs-charter,,,,95,,,
96,Charter,new-west-charter,1905 Armacost Ave,Los Angeles,New West Charter,"[('new west charter', 100.0, 'new-west-charter')]",new-west-charter,SBE - New West Charter,Active,1905 Armacost Ave.,100,,,
97,Charter,north-valley-military-institute,12105 Allegheny Street,Sun Valley,North Valley Military Institute,"[('north valley military institute college preparatory academy', 90.0, 'north-valley-military-institute-college-preparatory-academy')]",north-valley-military-institute-college-preparatory-academy,,,,90,,,
98,Charter,pacoima-charter-school,11016 Norris Ave.,Pacoima,Pacoima Charter School,[],,,,,,,,
99,Charter,para-los-ninos---evelyn-thurman-gratts-primary-center (tk-2),474 Hartford Avenue,Los Angeles,Para Los Ninos - Evelyn Thurman Gratts Primary Center (TK-2),[],,,,,,,,
100,Charter,para-los-ninos---,,,Para Los Ninos - ,[],,,,,,,,
101,Charter,russell-westbrook-why-not?-high-school,,,Russell Westbrook Why Not? High School,"[('russell westbrook why not  high', 95.0, 'russell-westbrook-why-not?-high')]",russell-westbrook-why-not?-high,,,,95,,,
102,Charter,russell-westbrook-why-not?-middle-school,,,Russell Westbrook Why Not? Middle School,"[('russell westbrook why not  middle', 95.0, 'russell-westbrook-why-not?-middle')]",russell-westbrook-why-not?-middle,,,,95,,,
103,Charter,scholarship-prep,24910 S. Avalon Blvd,Wilmington,Scholarship Prep,"[('scholarship prep   south bay', 90.0, 'scholarship-prep---south-bay')]",scholarship-prep---south-bay,,,,90,,,
104,Charter,synergy-academies,,,Synergy Academies,[],,,,,,,,
105,Charter,time-community-schools,,,TIME Community Schools,"[('time community', 90.0, 'time-community')]",time-community,,,,90,,,
106,Charter,value-schools,,,Value Schools,[],,,,,,,,
