rowid,school,district,street,city,state,zip
680,Animo City of Champions Charter High (Green Dot Charter Schools District),Green Dot Charter Schools District,9330 South Eighth Ave.,Inglewood,CA,90305-2914
681,Animo Ellen Ochoa Charter Middle (Green Dot Charter Schools District),Green Dot Charter Schools District,4360 Dozier St.,Los Angeles,CA,90022-1840
682,Animo Florence-Firestone Charter Middle (Green Dot Charter Schools District),Green Dot Charter Schools District,8255 Beach St.,Los Angeles,CA,90001-4014
683,Animo Jackie Robinson High (Green Dot Charter Schools District),Green Dot Charter Schools District,3500 South Hill St.,Los Angeles,CA,90007-4333
684,Animo James B. Taylor Charter Middle (Green Dot Charter Schools District),Green Dot Charter Schools District,810 East 111th Pl.,Los Angeles,CA,90059-1520
685,Animo Jefferson Charter Middle (Green Dot Charter Schools District),Green Dot Charter Schools District,1655 East 27th St.,Los Angeles,CA,90011-2202
686,Animo Legacy Charter Middle (Green Dot Charter Schools District),Green Dot Charter Schools District,12226 South Western Ave.,Los Angeles,CA,90047-5240
687,Animo Mae Jemison Charter Middle (Green Dot Charter Schools District),Green Dot Charter Schools District,12700 S. Avalon Blvd.,Los Angeles,CA,90061-2730
688,Animo Pat Brown (Green Dot Charter Schools District),Green Dot Charter Schools District,8255 Beach St.,Los Angeles,CA,90001-4014
689,Animo Ralph Bunche Charter High (Green Dot Charter Schools District),Green Dot Charter Schools District,1655 East 27th St.,Los Angeles,CA,90011-2202
690,Animo South Los Angeles Charter (Green Dot Charter Schools District),Green Dot Charter Schools District,11130 Western Ave.,Los Angeles,CA,90047-4845
691,Animo Venice Charter High (Green Dot Charter Schools District),Green Dot Charter Schools District,820 Broadway St.,Venice,CA,90291-3408
692,Animo Watts College Preparatory Academy (Green Dot Charter Schools District),Green Dot Charter Schools District,12628 Avalon Blvd.,Los Angeles,CA,90061-2728
693,Animo Westside Charter Middle (Green Dot Charter Schools District),Green Dot Charter Schools District,5456 McConnell Ave.,Los Angeles,CA,90066-2056
694,Baldwin Academy (Hacienda la Puente Unified),Hacienda la Puente Unified,1616 Griffith Ave.,La Puente,CA,91744-1237
695,Bixby Elementary (Hacienda la Puente Unified),Hacienda la Puente Unified,16446 Wedgeworth Dr.,Hacienda Heights,CA,91745-3044
696,California Elementary (Hacienda la Puente Unified),Hacienda la Puente Unified,1111 California Ave.,La Puente,CA,91744-1927
697,Cedarlane Academy (Hacienda la Puente Unified),Hacienda la Puente Unified,16333 Cedarlane Dr.,Hacienda Heights,CA,91745-2947
698,Newton Middle (Hacienda la Puente Unified),Hacienda la Puente Unified,15616 Newton St.,Hacienda Heights,CA,91745-4141
699,Orange Grove Middle (Hacienda la Puente Unified),Hacienda la Puente Unified,14505 Orange Grove Ave.,Hacienda Heights,CA,91745-2554
700,Palm Canyon (Hacienda la Puente Unified),Hacienda la Puente Unified,15151 Palm Ave.,Hacienda Heights,CA,91745-2000
701,Palm Elementary (Hacienda la Puente Unified),Hacienda la Puente Unified,14740 East Palm Ave.,Hacienda Heights,CA,91745-1938
702,Puente Hills High (Hacienda la Puente Unified),Hacienda la Puente Unified,15430 Shadybend Dr.,Hacienda Heights,CA,91746-2829
703,Sierra Vista Middle (Hacienda la Puente Unified),Hacienda la Puente Unified,15801 Sierra Vista Ct.,La Puente,CA,91744-4040
704,Sparks Elementary (Hacienda la Puente Unified),Hacienda la Puente Unified,15151 East Temple Ave.,La Puente,CA,91744-3765
705,Sparks Middle (Hacienda la Puente Unified),Hacienda la Puente Unified,15100 Giordano St.,La Puente,CA,91744-2718
706,St. Joseph Elementary (Hacienda la Puente Unified),Hacienda la Puente Unified,15650 East Temple Ave.,La Puente,CA,91744-3924
707,St. Mark's Lutheran Elementary (Hacienda la Puente Unified),Hacienda la Puente Unified,2323 Las lomitas Dr.,Hacienda Heights,CA,91745-4414
708,Sunset (Hacienda la Puente Unified),Hacienda la Puente Unified,800 North Tonopah Ave.,La Puente,CA,91744-2460
709,Sunset Elementary (Hacienda la Puente Unified),Hacienda la Puente Unified,800 North Tonopah Ave.,La Puente,CA,91744-2460
710,United Christian Education Center (Hacienda la Puente Unified),Hacienda la Puente Unified,16152 Gale Ave.,Hacienda Heights,CA,91745-1720
711,Valinda School of Academics (Hacienda la Puente Unified),Hacienda la Puente Unified,1030 Indian Summer Ave.,Valinda,CA,91744-2333
712,Valley Alternative High (Continuation) (Hacienda la Puente Unified),Hacienda la Puente Unified,15430 Shadybend Dr.,Hacienda Heights,CA,91745-2121
713,Valley Community Day (Hacienda la Puente Unified),Hacienda la Puente Unified,15430 Shadybend Dr.,Hacienda Heights,CA,91745-2121
714,Wedgeworth Elementary (Hacienda la Puente Unified),Hacienda la Puente Unified,16949 Wedgeworth Dr.,Hacienda Heights,CA,91745-3124
715,William Workman High (Hacienda la Puente Unified),Hacienda la Puente Unified,16303 East Temple Ave.,City Of Industry,CA,91744-4162
716,Willow Adult (Hacienda la Puente Unified),Hacienda la Puente Unified,14101 East Nelson Ave.,La Puente,CA,91746-2041
717,Wing Lane Elementary (Hacienda la Puente Unified),Hacienda la Puente Unified,16605 Wing Ln.,Valinda,CA,91744-4156
718,Workman Elementary (Hacienda la Puente Unified),Hacienda la Puente Unified,16000 Workman St.,La Puente,CA,91744-4738
719,Del Valle Elementary (Hacienda la Puente Unified),Hacienda la Puente Unified,801 North Del Valle St.,La Puente,CA,91744-3017
720,DEWAY SCHOOL (Hacienda la Puente Unified),Hacienda la Puente Unified,17800 Castleton St. Ste. 685,City of Industry,CA,91748-5766
721,Dibble Adult (Hacienda la Puente Unified),Hacienda la Puente Unified,1600 Pontenova Ave.,Hacienda Heights,CA,91745-2823
722,Fairgrove Academy (Hacienda la Puente Unified),Hacienda la Puente Unified,15540 Fairgrove Ave.,La Puente,CA,91744-1620
723,Glen A. Wilson High (Hacienda la Puente Unified),Hacienda la Puente Unified,16455 Wedgeworth Dr.,Hacienda Heights,CA,91745-3045
724,"Grandview, College Preparatory Academy (Hacienda la Puente Unified)",Hacienda la Puente Unified,795 North Grandview Ln.,Valinda,CA,91744-4259
725,Grazide Elementary (Hacienda la Puente Unified),Hacienda la Puente Unified,2850 Leopold Ave.,Hacienda Heights,CA,91745-5425
726,Hacienda La Puente Adult Education (Hacienda la Puente Unified),Hacienda la Puente Unified,14101 East Nelson Ave.,La Puente,CA,91746-2640
727,Kwis Elementary (Hacienda la Puente Unified),Hacienda la Puente Unified,1925 South Kwis Ave.,Hacienda Heights,CA,91745-3331
728,La Puente High (Hacienda la Puente Unified),Hacienda la Puente Unified,15615 East Nelson Ave.,La Puente,CA,91744-3910
729,Lassalette (Hacienda la Puente Unified),Hacienda la Puente Unified,14333 Lassalette St.,La Puente,CA,91744-2441
730,Los Altos Elementary (Hacienda la Puente Unified),Hacienda la Puente Unified,15565 Los Altos Dr.,Hacienda Heights,CA,91745-5216
731,Los Altos High (Hacienda la Puente Unified),Hacienda la Puente Unified,15325 East Los Robles Ave.,Hacienda Heights,CA,91745-2717
732,Los Molinos Elementary (Hacienda la Puente Unified),Hacienda la Puente Unified,3112 Las Marias Ave.,Hacienda Heights,CA,91745-6218
733,Los Robles Academy (Hacienda la Puente Unified),Hacienda la Puente Unified,1530 South Ridley Ave.,Hacienda Heights,CA,91745-3245
734,Mesa Robles (Hacienda la Puente Unified),Hacienda la Puente Unified,16060 Mesa Robles Dr.,Hacienda Heights,CA,91745-4858
735,Molokan Elementary School (Hacienda la Puente Unified),Hacienda la Puente Unified,16222 East Soriano Dr.,Hacienda Heights,CA,91745-4840
736,Nelson Elementary (Hacienda la Puente Unified),Hacienda la Puente Unified,330 North California Ave.,La Puente,CA,91744-3718
737,New Montessori School (Hacienda la Puente Unified),Hacienda la Puente Unified,15243 E. Nelson Ave,Yorba Linda,CA,92886
738,Hart ROP (Hart ROP),Hart ROP,21515 Centre Point Pkwy.,Santa Clarita,CA,91350-2947
739,Trinity Lutheran School (Hawthorne),Hawthorne,4783 West 130th St.,Hawthorne,CA,90250-5148
740,Washington (Hawthorne),Hawthorne,4339 West 129th St.,Hawthorne,CA,90250-5210
741,York (Hawthorne),Hawthorne,11838 South York Ave.,Hawthorne,CA,90250-3125
742,Zela Davis (Hawthorne),Hawthorne,13435 South Yukon Ave.,Hawthorne,CA,90250-6228
743,Al-Huda Islamic School (Hawthorne),Hawthorne,12227 Hawthorne Way,Hawthorne,CA,90250-3811
744,Bud Carson Middle (Hawthorne),Hawthorne,13838 South Yukon Ave.,Hawthorne,CA,90250-7716
745,Eucalyptus (Hawthorne),Hawthorne,12044 South Eucalyptus Ave.,Hawthorne,CA,90250-3602
746,Hawthorne Math and Science Academy (Hawthorne),Hawthorne,4467 West Broadway,Hawthorne,CA,90250-3819
747,Hawthorne Middle (Hawthorne),Hawthorne,4366 West 129th St.,Hawthorne,CA,90250-5211
748,Jefferson (Hawthorne),Hawthorne,4091 West 139th St.,Hawthorne,CA,90250-7303
749,Kornblum (Hawthorne),Hawthorne,3620 West El Segundo Blvd.,Hawthorne,CA,90250-4819
750,Prairie Vista Middle (Hawthorne),Hawthorne,13600 South Prairie Ave.,Hawthorne,CA,90250-7306
751,Ramona (Hawthorne),Hawthorne,4617 West 136th St.,Hawthorne,CA,90250-5735
752,Rising Stars Academy (Hawthorne),Hawthorne,13703 Prairie Ave,Hawthorne,CA,90250-7307
753,St. Joseph Elementary (Hawthorne),Hawthorne,11886 Acacia Ave.,Hawthorne,CA,90250-3003
754,Hermosa Valley Elementary (Hermosa Beach City Elementary),Hermosa Beach City Elementary,1645 Valley Dr.,Hermosa Beach,CA,90254-2921
755,Hermosa View Elementary (Hermosa Beach City Elementary),Hermosa Beach City Elementary,417 25th St,Hermosa Beach,CA,90254-3350
756,Our Lady of Guadalupe Elementary (Hermosa Beach City Elementary),Hermosa Beach City Elementary,340 Massey St.,Hermosa Beach,CA,90254-4927
757,Hughes-Elizabeth Lakes (Hughes-Elizabeth Lakes Union Elementary),Hughes-Elizabeth Lakes Union Elementary,16633 Elizabeth Lake Rd.,Lake Hughes,CA,93532-1229
758,ICEF View Park Preparatory Elementary (ICEF Public Schools District),ICEF Public Schools District,5311 South Crenshaw Blvd.,Los Angeles,CA,90043-1809
759,ICEF View Park Preparatory High (ICEF Public Schools District),ICEF Public Schools District,5701 South Crenshaw Blvd.,Los Angeles,CA,90043-2409
760,ICEF View Park Preparatory Middle (ICEF Public Schools District),ICEF Public Schools District,5311 Crenshaw Blvd.,Los Angeles,CA,90043-1809
761,ICEF Vista Elementary Academy (ICEF Public Schools District),ICEF Public Schools District,4471 Inglewood Blvd.,Los Angeles,CA,90066-6209
762,ICEF Vista Middle Academy (ICEF Public Schools District),ICEF Public Schools District,4471 Inglewood Blvd.,Los Angeles,CA,90066-6209
763,ICEF Inglewood Elementary Charter Academy (ICEF Public Schools District),ICEF Public Schools District,434 South Grevillea Ave.,Inglewood,CA,90301-2300
764,ICEF Innovation Los Angeles Charter (ICEF Public Schools District),ICEF Public Schools District,5029 South Vermont Ave.,Los Angeles,CA,90043-2907
765,Academia Moderna (Independent Charter Schools District),Independent Charter Schools District,2410 Broadway,Walnut Park,CA,90255-6342
766,Academy of Media Arts (Independent Charter Schools District),Independent Charter Schools District,2009 West Martin Luther King Blvd.,Los Angeles,CA,90062-1434
767,Accelerated (Independent Charter Schools District),Independent Charter Schools District,4000 South Main St.,Los Angeles,CA,90037-1022
768,Accelerated Charter Elementary (Independent Charter Schools District),Independent Charter Schools District,3914 South Main St.,Los Angeles,CA,90037-1253
769,Brentwood School (Independent Charter Schools District),Independent Charter Schools District,100 South Barrington Pl.,Los Angeles,CA,90049-3306
770,Bridgeport Vocational West School (Independent Charter Schools District),Independent Charter Schools District,4160 Grand View Blvd,Los Angeles,CA,90066-5214
771,Collegiate Charter High School of Los Angeles (Independent Charter Schools District),Independent Charter Schools District,725 South Indiana St.,Los Angeles,CA,90023-1840
772,Extera Public (Independent Charter Schools District),Independent Charter Schools District,2226 East Third St.,Los Angeles,CA,90033-3906
773,Extera Public School No. 2 (Independent Charter Schools District),Independent Charter Schools District,1015 South Lorena St.,Los Angeles,CA,90023-2222
774,International Virtual Learning Academy (Independent Charter Schools District),Independent Charter Schools District,"2828 Cochran St., Number 380",Simi Valley,CA,93065
775,Invictus Leadership Academy (Independent Charter Schools District),Independent Charter Schools District,6715 South Western Ave.,Los Angeles,CA,90047-1837
776,Ivy Academia (Independent Charter Schools District),Independent Charter Schools District,5975 Shoup Ave.,Woodland Hills,CA,91367-3329
777,"Ivy Bound Academy Math, Science, and Technology Charter Middle 2 (Independent Charter Schools District)",Independent Charter Schools District,20040 Parthenia St.,Northridge,CA,91324-3222
778,"Ivy Bound Academy of Math, Science, and Technology Charter Middle (Independent Charter Schools District)",Independent Charter Schools District,15355 Morrison St.,Sherman Oaks,CA,91403-1514
779,Learning by Design Charter (Independent Charter Schools District),Independent Charter Schools District,7019 South Van Ness Ave.,Los Angeles,CA,90047-1659
780,Libertas College Preparatory Charter (Independent Charter Schools District),Independent Charter Schools District,3875 Dublin Ave.,Los Angeles,CA,90008-1945
781,N.E.W. Academy of Science and Arts (Independent Charter Schools District),Independent Charter Schools District,379 South Loma Ave.,Los Angeles,CA,90017-1142
782,Conservation Corps of Long Beach (Independent Charter Schools District),Independent Charter Schools District,340 Nieto Ave.,Long Beach,CA,90814
783,Global Education Academy (Independent Charter Schools District),Independent Charter Schools District,4141 South Figueroa St.,Los Angeles,CA,90037-2038
784,Global Education Academy 2 (Independent Charter Schools District),Independent Charter Schools District,1717 Seventh Ave.,Los Angeles,CA,90019-6004
785,Goethe International Charter (Independent Charter Schools District),Independent Charter Schools District,12500 Braddock Dr.,Los Angeles,CA,90066-6808
786,James Jordan Middle School Charter (Independent Charter Schools District),Independent Charter Schools District,7911 Winnetka Ave.,Winnetka,CA,91306-2317
787,Math and Science College Preparatory (Independent Charter Schools District),Independent Charter Schools District,3202 West Adams Blvd.,Los Angeles,CA,90018-1832
788,Matrix for Success Academy (Independent Charter Schools District),Independent Charter Schools District,1010 East 34th St.,Los Angeles,CA,90011-2527
789,Our Community Charter (Independent Charter Schools District),Independent Charter Schools District,10045 Jumilla Ave.,Chatsworth,CA,91311-3507
790,TREE Academy (Independent Charter Schools District),Independent Charter Schools District,8628 Holloway Dr,West Hollywood,CA,90069-2304
791,Watts Learning Center (Independent Charter Schools District),Independent Charter Schools District,310 West 95th St.,Los Angeles,CA,90003-4012
792,Watts Learning Center Charter Middle (Independent Charter Schools District),Independent Charter Schools District,8800 South San Pedro St.,Los Angeles,CA,90003-3541
793,WISH Academy High (Independent Charter Schools District),Independent Charter Schools District,7400 West Manchester Ave.,Los Angeles,CA,90045-2322
794,Renaissance Arts Academy (Independent Charter Schools District),Independent Charter Schools District,2558 N San Fernando Road,Los Angeles,CA,90065
795,Puente Charter (Independent Charter Schools District),Independent Charter Schools District,501 South Boyle Ave.,Los Angeles,CA,90033-3816
796,Scholarship Prep - South Bay (Independent Charter Schools District),Independent Charter Schools District,24910 S. Avalon Blvd.,Wilmington,CA,90744-1029
797,Stella Elementary Charter Academy (Independent Charter Schools District),Independent Charter Schools District,2636 S. Mansfield Ave.,Los Angeles,CA,90016-3512
798,Stella Middle Charter Academy (Independent Charter Schools District),Independent Charter Schools District,4301 West MLK Blvd.,Los Angeles,CA,90016-1719
799,T.I.M.E. Community (Independent Charter Schools District),Independent Charter Schools District,2100 West Cleveland Ave.,Montebello,CA,90640-4032
800,We the People High (Independent Charter Schools District),Independent Charter Schools District,1635 Long Beach Blvd.,Long Beach,CA,90813-2304
801,ABC LITTLE SCHOOL (Independent Charter Schools District),Independent Charter Schools District,14926 Burbank Blvd,Sherman Oaks,CA,91411-3609
802,ABC Little School - North Hills (Independent Charter Schools District),Independent Charter Schools District,9025 LANGDON AVE.,NORTH HILLS,CA,91343-3918
803,"ABC Little School Van Nuys, LLC (Independent Charter Schools District)",Independent Charter Schools District,6447 Woodman Ave.,Van Nuys,CA,91401-1603
804,"ABC Little School, Studio City (Independent Charter Schools District)",Independent Charter Schools District,11728 Moorpark St.,Studio City,CA,91604-2111
805,Abraham Joshua Heschel Day School (Independent Charter Schools District),Independent Charter Schools District,17701 Devonshire St.,Northridge,CA,91325-1213
806,Discovery Charter Preparatory #2 (Independent Charter Schools District),Independent Charter Schools District,13570 Eldridge Ave.,Sylmar,CA,91342-2343
807,Frederick K.C. Price III Christian Schools (Independent Charter Schools District),Independent Charter Schools District,7901 S. Vermont Ave.,Los Angeles,CA,90044-3531
808,Hollywood Schoolhouse (Independent Charter Schools District),Independent Charter Schools District,1233 North McCadden Pl.,Los Angeles,CA,90038-1214
809,Birmingham Community Charter High (Independent Charter Schools District),Independent Charter Schools District,17000 Haynes St.,Lake Balboa,CA,91406-5420
810,Bishop Conaty Our Lady of Loretto High School (Independent Charter Schools District),Independent Charter Schools District,2900 West Pico Blvd.,Los Angeles,CA,90006-3802
811,CHIME Institute's Schwarzenegger Community (Independent Charter Schools District),Independent Charter Schools District,19722 Collier St.,Woodland Hills,CA,91364-3618
812,City Language Immersion Charter (Independent Charter Schools District),Independent Charter Schools District,4001 Venice Blvd.,Los Angeles,CA,90019-6009
813,Granada Hills Charter (Independent Charter Schools District),Independent Charter Schools District,10535 Zelzah Ave.,Granada Hills,CA,91344-5902
814,Los Angeles Academy of Arts and Enterprise (Independent Charter Schools District),Independent Charter Schools District,1200 West Colton St.,Los Angeles,CA,90026-5816
815,Los Angeles Leadership Academy (Independent Charter Schools District),Independent Charter Schools District,234 East Avenue 33,Los Angeles,CA,90031-1937
816,Los Angeles Leadership Primary Academy (Independent Charter Schools District),Independent Charter Schools District,2670 Griffin Ave.,Los Angeles,CA,90031-2311
817,Los Feliz Charter Middle School for the Arts (Independent Charter Schools District),Independent Charter Schools District,2709 Media Center Dr.,Los Angeles,CA,90065-1700
818,Los Feliz Charter School for the Arts (Independent Charter Schools District),Independent Charter Schools District,2709 Media Center Dr.,Los Angeles,CA,90065-1700
819,Louisville High School (Independent Charter Schools District),Independent Charter Schools District,22300 Mulholland Dr.,Woodland Hills,CA,91364-4933
820,Loyola High School of Los Angeles (Independent Charter Schools District),Independent Charter Schools District,1901 Venice Blvd.,Los Angeles,CA,90006-4401
821,Ocean Charter (Independent Charter Schools District),Independent Charter Schools District,12606 Culver Blvd.,Los Angeles,CA,90066-6506
822,St. Bernard Elementary (Independent Charter Schools District),Independent Charter Schools District,3254 Verdgugo Rd.,Los Angeles,CA,90065
823,The Archer School for Girls (Independent Charter Schools District),Independent Charter Schools District,11725 Sunset Blvd.,Los Angeles,CA,90049-2918
824,The City School (Independent Charter Schools District),Independent Charter Schools District,17424 Sherman Way,Lake Balboa,CA,91406-3506
825,The Episcopal School of Los Angeles (Independent Charter Schools District),Independent Charter Schools District,6325 Santa Monica Blvd.,Los Angeles,CA,90038-1694
826,The John Thomas Dye School (Independent Charter Schools District),Independent Charter Schools District,11414 Chalon Rd.,Los Angeles,CA,90049-1700
827,Immaculate Heart High School and Middle School (Independent Charter Schools District),Independent Charter Schools District,5515 Franklin Ave,Los Angeles,CA,90028-5901
828,Ingenium Charter (Independent Charter Schools District),Independent Charter Schools District,22250 Elkwood St.,Canoga Park,CA,91304-5501
829,Ingenium Charter Middle (Independent Charter Schools District),Independent Charter Schools District,7330 Winnetka Ave.,Winnetka,CA,91306-2905
830,International School of Los Angeles-BB (Independent Charter Schools District),Independent Charter Schools District,1105 West Riverside Dr.,Burbank,CA,91506-3214
831,Larchmont Charter (Independent Charter Schools District),Independent Charter Schools District,1265 North Fairfax Ave.,West Hollywood,CA,90046-5205
832,Montessori Academy of West Adams (Independent Charter Schools District),Independent Charter Schools District,4449 W Adams Blvd,Los Angeles,CA,90016-3058
833,Multicultural Learning Center (Independent Charter Schools District),Independent Charter Schools District,7510 DeSoto Ave.,Canoga Park,CA,91303-1430
834,N.E.W. Academy Canoga Park (Independent Charter Schools District),Independent Charter Schools District,21425 Cohasset St.,Canoga Park,CA,91303-1450
835,PREPA TEC - Los Angeles (Independent Charter Schools District),Independent Charter Schools District,2665 Clarendon Ave.,Huntington Park,CA,90255-4138
836,Public Policy Charter (Independent Charter Schools District),Independent Charter Schools District,1701 Browning Blvd.,Los Angeles,CA,90062-1302
837,Intellectual Virtues Academy of Long Beach (Independent Charter Schools District),Independent Charter Schools District,3601 Linden Ave.,Long Beach,CA,90807-4001
838,North Valley Military Institute College Preparatory Academy (Independent Charter Schools District),Independent Charter Schools District,12105 Allegheny St.,Sun Valley,CA,91352
839,Bright Star Secondary Charter Academy (Independent Charter Schools District),Independent Charter Schools District,1600 W. Imperial Hwy.,Los Angeles,CA,90047-4810
840,Briskin Elementary School of Temple Israel of Hollywood (Independent Charter Schools District),Independent Charter Schools District,7300 Hollywood Blvd.,Los Angeles,CA,90046-2904
841,Environmental Charter High (Independent Charter Schools District),Independent Charter Schools District,16315 Grevillea Ave.,Lawndale,CA,90260-2858
842,New Village Girls Academy (Independent Charter Schools District),Independent Charter Schools District,147 North Occidental Blvd.,Los Angeles,CA,90026-4601
843,Northpoint School (Independent Charter Schools District),Independent Charter Schools District,9650 Zelzah Ave.,Northridge,CA,91325-2003
844,Da Vinci RISE High (Independent Charter Schools District),Independent Charter Schools District,201 North Douglas St.,El Segundo,CA,90245-4637
845,New Designs Charter (Independent Charter Schools District),Independent Charter Schools District,2303 South Figueroa Way,Los Angeles,CA,90007-2504
846,New Designs Charter School-Watts (Independent Charter Schools District),Independent Charter Schools District,12714 South Avalon Blvd.,Los Angeles,CA,90061-2730
847,New Heights Charter (Independent Charter Schools District),Independent Charter Schools District,2202 West Martin Luther King Jr Blvd.,Los Angeles,CA,90008-2723
848,New Horizons Charter Academy (Independent Charter Schools District),Independent Charter Schools District,5955 Lankershim Blvd.,North Hollywood,CA,91601-1006
849,New Los Angeles Charter (Independent Charter Schools District),Independent Charter Schools District,1919 South Burnside Ave.,Los Angeles,CA,90016-1114
850,New Los Angeles Charter Elementary (Independent Charter Schools District),Independent Charter Schools District,5421 Obama Rd.,Los Angeles,CA,90016-5122
851,New Millennium Secondary (Independent Charter Schools District),Independent Charter Schools District,1301 West 182nd St.,Gardena,CA,90248-3322
852,Environmental Charter Middle (Independent Charter Schools District),Independent Charter Schools District,812 West 165th Pl.,Gardena,CA,90247-5105
853,Environmental Charter Middle - Inglewood (Independent Charter Schools District),Independent Charter Schools District,3600 West Imperial Hwy.,Inglewood,CA,90303-2714
854,Anahuacalmecac International University Preparatory of North America (Independent Charter Schools District),Independent Charter Schools District,4736 Huntington Dr. South,Los Angeles,CA,90032-1942
855,Resolute Academy Charter (Independent Charter Schools District),Independent Charter Schools District,1265 East 112th St.,Los Angeles,CA,90059-1137
856,Vista Charter Middle (Independent Charter Schools District),Independent Charter Schools District,2900 West Temple St.,Los Angeles,CA,90026-4516
857,Vista Horizon Global Academy (Independent Charter Schools District),Independent Charter Schools District,980 South Hobart Blvd.,Los Angeles,CA,90006-1220
858,Vox Collegiate of Los Angeles (Independent Charter Schools District),Independent Charter Schools District,1100 West Manchester Ave.,Los Angeles,CA,90044-3430
859,Wallis Annenberg High (Independent Charter Schools District),Independent Charter Schools District,4000 South Main St.,Los Angeles,CA,90037-1022
860,Castle Elementary School (Independent Charter Schools District),Independent Charter Schools District,1435 West 120th St.,Los Angeles,CA,90047-5302
