rowid,school,district,street,city,state,zip
2284,University of Silvaner(LAUSD),Los Angeles Unified,3460 Wilshire Blvd,Los Angeles,CA,90010-2206
2285,University Pathways Medical Magnet Academy(LAUSD),Los Angeles Unified,11227 South San Pedro St.,Los Angeles,CA,90061-2566
2286,University Pathways Public Service Academy(LAUSD),Los Angeles Unified,1415 Firestone Blvd.,Los Angeles,CA,90001-3854
2287,Utah Street Elementary(LAUSD),Los Angeles Unified,255 Gabriel Garcia Marquez St.,Los Angeles,CA,90033-2746
2288,Cesar E Chavez Learning Academy - Technology Preparatory Aca(LAUSD),Los Angeles Unified,1001 Arroyo Ave,San Fernando,CA,91340
2289,Catskill Avenue Elementary(LAUSD),Los Angeles Unified,23536 Catskill Ave.,Carson,CA,90745-5412
2290,CCDC of Little Angels(LAUSD),Los Angeles Unified,3808 W. 54th St.,Los Angeles,CA,90043-2200
2291,CDM Christian Elementary School(LAUSD),Los Angeles Unified,121 North Ave. 60,Los Angeles,CA,90042-4213
2292,CDS Elementary(LAUSD),Los Angeles Unified,10001 Jumilla Ave.,Chatsworth,CA,91311
2293,CDS Secondary(LAUSD),Los Angeles Unified,727 South Wilson St.,Los Angeles,CA,90021-1625
2294,Central Continuation High(LAUSD),Los Angeles Unified,716 East 14th St.,Los Angeles,CA,90021-2114
2295,Century Park Elementary(LAUSD),Los Angeles Unified,10935 South Spinning Ave.,Inglewood,CA,90303-2599
2296,Taft Charter High(LAUSD),Los Angeles Unified,5243 Oakland St.,Los Angeles,CA,90032-2335
2297,Downtown Business High(LAUSD),Los Angeles Unified,1001 Arroyo Ave.,San Fernando,CA,91340-1817
2298,UCLA Community K-12(LAUSD),Los Angeles Unified,1001 Arroyo Ave.,San Fernando,CA,91340-1817
2299,Ambassador School-Global Education(LAUSD),Los Angeles Unified,1001 Arroyo Ave.,San Fernando,CA,91340-1817
2300,Ambassador-Global Leadership(LAUSD),Los Angeles Unified,1001 Arroyo Ave.,San Fernando,CA,91340-1817
2301,Los Angeles High School of the Arts(LAUSD),Los Angeles Unified,1536 S Robertson Blvd,Los Angeles,CA,90035-4232
2302,Laurel Elementary(LAUSD),Los Angeles Unified,7500 Chaminade Ave.,West Hills,CA,91304-5384
2303,Laurel Elementary(LAUSD),Los Angeles Unified,10210 Oakdale Ave.,Chatsworth,CA,91311-3533
2304,Dr. Theodore T. Alexander Jr. Science Center(LAUSD),Los Angeles Unified,3737 South Figueroa St.,Los Angeles,CA,90007-4366
2305,Dubnoff School(LAUSD),Los Angeles Unified,15314 Rayen St.,North Hills,CA,91343-5118
2306,George Washington Carver Middle(LAUSD),Los Angeles Unified,4410 McKinley Ave.,Los Angeles,CA,90011-3614
2307,George Washington Preparatory High(LAUSD),Los Angeles Unified,10860 South Denker Ave.,Los Angeles,CA,90047-4622
2308,"Gerald A. Lawson Academy of the Arts, Mathematics and Science(LAUSD)",Los Angeles Unified,929 West 69th St.,Los Angeles,CA,90044-5200
2309,Germain Academy For Academic Achievement(LAUSD),Los Angeles Unified,20730 Germain St.,Chatsworth,CA,91311-2418
2310,Gil Garcetti Learning Academy(LAUSD),Los Angeles Unified,612 West 68th St.,Los Angeles,CA,90044-6204
2311,Gindi Maimonides Academy(LAUSD),Los Angeles Unified,8511 Beverly Pl.,Los Angeles,CA,90048-1937
2312,"Girls Academic Leadership Academy, Dr. Michelle King School for Sci, Tech, Eng and Math(LAUSD)",Los Angeles Unified,1067 West Blvd.,Los Angeles,CA,90019-1839
2313,"Glassell Park ES Science, Technology, Engineering, Arts and Math Magnet(LAUSD)",Los Angeles Unified,2211 West Avenue 30,Los Angeles,CA,90065-1204
2314,Hazeltine Avenue Elementary(LAUSD),Los Angeles Unified,7150 Hazeltine Ave.,Van Nuys,CA,91405-3244
2315,Helen Bernstein High(LAUSD),Los Angeles Unified,1309 North Wilton Pl.,Hollywood,CA,90028-8526
2316,Heliotrope Avenue Elementary(LAUSD),Los Angeles Unified,5911 Woodlawn Ave.,Maywood,CA,90270-3525
2317,HELP Group - Young Learners Preschool(LAUSD),Los Angeles Unified,13164 Burbank Blvd.,Sherman Oaks,CA,91401-6037
2318,Henry David Thoreau Continuation(LAUSD),Los Angeles Unified,5429 Quakertown Ave.,Woodland Hills,CA,91364-2528
2319,Henry T. Gage Middle(LAUSD),Los Angeles Unified,2880 East Gage Ave.,Huntington Park,CA,90255-4346
2320,Heritage Christian School(LAUSD),Los Angeles Unified,9825 Woodley Ave.,Northridge,CA,91343-1905
2321,Heritage Christian School(LAUSD),Los Angeles Unified,17531 Rinaldi St.,Granada Hills,CA,91344-3399
2322,Herrick Avenue Elementary(LAUSD),Los Angeles Unified,13350 Herrick Ave.,Sylmar,CA,91342-7601
2323,Hesby Oaks Leadership Charter(LAUSD),Los Angeles Unified,15530 Hesby St.,Encino,CA,91436-1519
2324,Marcus Garvey School(LAUSD),Los Angeles Unified,3349 W 43Rd St.,Los Angeles,CA,90008-4521
2325,Marguerite Poindexter LaMotte Elementary(LAUSD),Los Angeles Unified,4410 Orchard Ave.,Los Angeles,CA,90037-3018
2326,Maria Regina(LAUSD),Los Angeles Unified,13510 S. Van Ness Ave.,Gardena,CA,90249-2418
2327,Marianna Avenue Elementary(LAUSD),Los Angeles Unified,4215 East Gleason St.,Los Angeles,CA,90063-1423
2328,Marina del Rey Middle(LAUSD),Los Angeles Unified,12500 Braddock Dr.,Los Angeles,CA,90066-6808
2329,Mariposa-Nabi Primary Center(LAUSD),Los Angeles Unified,987 South Mariposa Ave.,Los Angeles,CA,90006-1413
2330,Mark Twain Middle(LAUSD),Los Angeles Unified,2224 Walgrove Ave.,Los Angeles,CA,90066-3502
2331,Marlborough School(LAUSD),Los Angeles Unified,250 South Rossmore Ave.,Los Angeles,CA,90004-3739
2332,Marlton(LAUSD),Los Angeles Unified,4000 Santo Tomas Dr.,Los Angeles,CA,90008-3304
2333,Marquez Charter(LAUSD),Los Angeles Unified,16821 Marquez Ave.,Pacific Palisades,CA,90272-3243
2334,San Fernando Institute of Applied Media(LAUSD),Los Angeles Unified,130 North Brand Blvd.,San Fernando,CA,91340-2901
2335,San Fernando Middle(LAUSD),Los Angeles Unified,130 North Brand Blvd.,San Fernando,CA,91340-2996
2336,San Fernando Senior High(LAUSD),Los Angeles Unified,11133 O'Melveny Ave.,San Fernando,CA,91340-4426
2337,San Fernando Valley Academy(LAUSD),Los Angeles Unified,17601 Lassen St,Northridge,CA,91325-1408
2338,San Gabriel Avenue Elementary(LAUSD),Los Angeles Unified,8628 San Gabriel Ave.,South Gate,CA,90280-3112
2339,San Jose Street Elementary(LAUSD),Los Angeles Unified,14928 Clymer St.,Mission Hills,CA,91345-2111
2340,San Miguel Elementary(LAUSD),Los Angeles Unified,9801 San Miguel Ave.,South Gate,CA,90280-4823
2341,San Pascual Elementary Science Technology Engineering Arts And Mathematics (STEAM) Magnet(LAUSD),Los Angeles Unified,815 San Pascual Ave.,Los Angeles,CA,90042-3030
2342,San Pedro Senior High(LAUSD),Los Angeles Unified,1001 West 15th St.,San Pedro,CA,90731-3925
2343,San Pedro Street Elementary(LAUSD),Los Angeles Unified,1635 South San Pedro St.,Los Angeles,CA,90015-3706
2344,Santa Isabel(LAUSD),Los Angeles Unified,2424 Whittier Blvd.,Los Angeles,CA,90023-1302
2345,Santa Rosa de Lima(LAUSD),Los Angeles Unified,1316 Griffith St.,San Fernando,CA,91340-3958
2346,Santa Teresita Elementary(LAUSD),Los Angeles Unified,2646 Zonal Ave.,Los Angeles,CA,90033-1436
2347,Santee Education Complex(LAUSD),Los Angeles Unified,1921 South Maple Ave.,Los Angeles,CA,90011-1036
2348,Sara Coughlin Elementary(LAUSD),Los Angeles Unified,11035 Borden St.,Pacoima,CA,91331-1533
2349,Saticoy Elementary(LAUSD),Los Angeles Unified,7850 Ethel Ave.,North Hollywood,CA,91605-1940
2350,St. Mary Coptic Orthodox school(LAUSD),Los Angeles Unified,17431 Roscoe Blvd,Northridge,CA,91325-3903
2351,St. Mary School(LAUSD),Los Angeles Unified,416 South St. Louis St.,Los Angeles,CA,90033-4395
2352,St. Matthew's Parish School(LAUSD),Los Angeles Unified,1031 Bieveneda Ave.,Pacific Palisades,CA,90272-0037
2353,St. Matthias Elementary School(LAUSD),Los Angeles Unified,7130 Cedar St.,Huntington Park,CA,90255-5248
2354,St. Mel Elementary(LAUSD),Los Angeles Unified,20874 Ventura Blvd.,Woodland Hills,CA,91364-2318
2355,St. Michael Elementary(LAUSD),Los Angeles Unified,1027 West 87th St.,Los Angeles,CA,90044-2107
2356,St. Michael the Archangel Academy(LAUSD),Los Angeles Unified,15117 POLK ST,SYLMAR,CA,91342-5016
2357,Youth Opportunities Unlimited(LAUSD),Los Angeles Unified,915 West Manchester Ave.,Los Angeles,CA,90044-4915
2358,Zane Grey Continuation(LAUSD),Los Angeles Unified,18230 Kittridge St.,Reseda,CA,91335-6115
2359,The Pines Christian School(LAUSD),Los Angeles Unified,25200 S. Western Ave.,Harbor City,CA,90710-2611
2360,Los Angeles Unified School District ROCP (Los Angeles Unified ROCP),Los Angeles Unified ROCP,333 South Beaudry Ave.,Los Angeles,CA,90017-1466
2361,Ada S. Nelson Elementary (Los Nietos),Los Nietos,8140 South Vicki Dr.,Whittier,CA,90606-3040
2362,Aeolian Elementary (Los Nietos),Los Nietos,11600 Aeolian St.,Whittier,CA,90606-3306
2363,Los Nietos Middle (Los Nietos),Los Nietos,11425 East Rivera Rd.,Los Nietos,CA,90606-3245
2364,Rancho Santa Gertrudes Elementary (Los Nietos),Los Nietos,11233 East Charlesworth Rd.,Santa Fe Springs,CA,90670-2820
2365,Hosler Middle (Lynwood Unified),Lynwood Unified,11300 Spruce St.,Lynwood,CA,90262-3629
2366,Janie P. Abbott Elementary (Lynwood Unified),Lynwood Unified,5260 East Clark St.,Lynwood,CA,90262-5443
2367,Lincoln Elementary (Lynwood Unified),Lynwood Unified,11031 State St.,Lynwood,CA,90262-2454
2368,Lindbergh Elementary (Lynwood Unified),Lynwood Unified,3300 Cedar Ave.,Lynwood,CA,90262-4850
2369,Lugo Elementary (Lynwood Unified),Lynwood Unified,4345 Pendleton Ave.,Lynwood,CA,90262-2326
2370,Lynwood Academic Academy (Lynwood Unified),Lynwood Unified,3919 Carlin Ave.,Lynwood,CA,90262-5203
2371,Lynwood Adult (Lynwood Unified),Lynwood Unified,11277 Atlantic Ave.,Lynwood,CA,90262-5106
2372,Lynwood High (Lynwood Unified),Lynwood Unified,4050 East Imperial Hwy.,Lynwood,CA,90262-2853
2373,Lynwood Middle (Lynwood Unified),Lynwood Unified,12124 Bullis Rd.,Lynwood,CA,90262-5106
2374,Marco Antonio Firebaugh High (Lynwood Unified),Lynwood Unified,5246 Martin Luther King Blvd.,Lynwood,CA,90262-3903
2375,Mark Twain Elementary (Lynwood Unified),Lynwood Unified,12315 Thorson Ave.,Lynwood,CA,90262-5243
2376,Pathway Independent Study (Lynwood Unified),Lynwood Unified,11300 Wright Rd.,Lynwood,CA,90262-3126
2377,Roosevelt Elementary (Lynwood Unified),Lynwood Unified,10835 Mallison Ave.,Lynwood,CA,90262-2113
2378,Rosa Parks Elementary (Lynwood Unified),Lynwood Unified,3900 Agnes St.,Lynwood,CA,90262-4415
2379,St. Emydius School (Lynwood Unified),Lynwood Unified,10990 California Ave.,Lynwood,CA,90262-2006
2380,St. Philip Neri (Lynwood Unified),Lynwood Unified,12522 Stoneacre Ave.,Lynwood,CA,90262-5314
2381,Thurgood Marshall Elementary (Lynwood Unified),Lynwood Unified,3593 Martin Luther King Blvd.,Lynwood,CA,90262-2048
2382,Vista High (Lynwood Unified),Lynwood Unified,11300 Wright Rd.,Lynwood,CA,90262-3126
2383,Washington Elementary (Lynwood Unified),Lynwood Unified,4225 Sanborn Ave.,Lynwood,CA,90262-2998
2384,Will Rogers Elementary (Lynwood Unified),Lynwood Unified,11220 Duncan Ave.,Lynwood,CA,90262-3041
2385,Wilson Elementary (Lynwood Unified),Lynwood Unified,11700 School St.,Lynwood,CA,90262-4348
2386,Calvary Christian Academy of Compton (Lynwood Unified),Lynwood Unified,1517 East Alondra Blvd.,Compton,CA,90221-4405
2387,Cesar Chavez Middle (Lynwood Unified),Lynwood Unified,3898 Abbott Rd.,Lynwood,CA,90262-2106
2388,Helen Keller Elementary (Lynwood Unified),Lynwood Unified,3521 Palm Ave.,Lynwood,CA,90262-5127
2389,Magnolia Science Academy 4 (Magnolia Science Academy District),Magnolia Science Academy District,"11330 West Graham Pl., B-9",Los Angeles,CA,90064
2390,Magnolia Science Academy 6 (Magnolia Science Academy District),Magnolia Science Academy District,3754 Dunn Dr.,Los Angeles,CA,90034-5805
2391,Magnolia Science Academy 7 (Magnolia Science Academy District),Magnolia Science Academy District,18355 Roscoe Blvd.,Northridge,CA,91325-4104
2392,Magnolia Science Academy Bell (Magnolia Science Academy District),Magnolia Science Academy District,6411 Orchard Ave.,Bell,CA,90201-1023
2393,Aurelia Pennekamp Elementary (Manhattan Beach Unified),Manhattan Beach Unified,110 South Rowell,Manhattan Beach,CA,90266-6962
2394,Beach Cities Learning Manhattan Beach (Manhattan Beach Unified),Manhattan Beach Unified,"1431 15th St., Bldg.s C & D",Manhattan Beach,CA,90266
2395,Creative Kids (Manhattan Beach Unified),Manhattan Beach Unified,1203 North Sepulveda Blvd.,Manhattan Beach,CA,90266-5103
2396,Grand View Elementary (Manhattan Beach Unified),Manhattan Beach Unified,455 24th St.,Manhattan Beach,CA,90266-4348
2397,Manhattan Academy (Manhattan Beach Unified),Manhattan Beach Unified,1740 Manhattan Beach Blvd.,Manhattan Beach,CA,90266-6220
2398,Manhattan Beach Middle (Manhattan Beach Unified),Manhattan Beach Unified,1501 North Redondo Ave.,Manhattan Beach,CA,90266-4214
2399,Manhattan Beach Preschool (Manhattan Beach Unified),Manhattan Beach Unified,1431 15th St.,Manhattan Beach,CA,90266-4077
2400,Meadows Avenue Elementary (Manhattan Beach Unified),Manhattan Beach Unified,1200 Meadows Ave.,Manhattan Beach,CA,90266-4059
2401,Mira Costa High (Manhattan Beach Unified),Manhattan Beach Unified,1401 Artesia Blvd.,Manhattan Beach,CA,90266-6968
2402,Montessori School of Manhattan Beach (Manhattan Beach Unified),Manhattan Beach Unified,315 South Peck Ave.,Manhattan Beach,CA,90266-6934
2403,Opal Robinson Elementary (Manhattan Beach Unified),Manhattan Beach Unified,80 Morningside Dr.,Manhattan Beach,CA,90266-6562
2404,Pacific Elementary (Manhattan Beach Unified),Manhattan Beach Unified,1200 Pacific Ave.,Manhattan Beach,CA,90266-4969
2405,American Martyrs School (Manhattan Beach Unified),Manhattan Beach Unified,1701 Laurel Ave.,Manhattan Beach,CA,90266-4904
2406,Bradoaks Elementary Science Academy (Monrovia Unified),Monrovia Unified,930 East Lemon Ave.,Monrovia,CA,91016-3076
2407,Calvary Chapel Monrovia PSP (Monrovia Unified),Monrovia Unified,1307 S. Myrtle Ave.,MONROVIA,CA,91016-4150
2408,Calvary Road Baptist Academy (Monrovia Unified),Monrovia Unified,319 West Olive Ave.,Monrovia,CA,91016-3339
2409,Canyon Early Learning Center (Monrovia Unified),Monrovia Unified,1000 South Canyon Blvd.,Monrovia,CA,91016-3535
2410,Canyon Oaks High (Monrovia Unified),Monrovia Unified,930 Royal Oaks Dr.,Monrovia,CA,91016-3735
2411,Clifton Middle (Monrovia Unified),Monrovia Unified,226 South Ivy Ave.,Monrovia,CA,91016-2836
2412,Excellence In Education Academy (Monrovia Unified),Monrovia Unified,2640 South Myrtle Ave. Ste. A7,Monrovia,CA,91016-8209
2413,Immaculate Conception (Monrovia Unified),Monrovia Unified,726 South Shamrock Ave.,Monrovia,CA,91016-3653
2414,Mayflower Elementary (Monrovia Unified),Monrovia Unified,210 North Mayflower Ave.,Monrovia,CA,91016-2008
2415,Monroe Elementary (Monrovia Unified),Monrovia Unified,402 West Colorado Blvd.,Monrovia,CA,91016-2647
2416,Monrovia Community Adult (Monrovia Unified),Monrovia Unified,920 South Mountain Ave.,Monrovia,CA,91016-3641
2417,Monrovia High (Monrovia Unified),Monrovia Unified,845 West Colorado Blvd.,Monrovia,CA,91016-2517
2418,Montessori Academy of Arcadia (Monrovia Unified),Monrovia Unified,940 W. Duarte Rd,Monrovia,CA,91016-4357
2419,Mountain Park (Monrovia Unified),Monrovia Unified,950 South Mountain Ave.,Monrovia,CA,91016-3641
2420,Pearl Preparatory (Monrovia Unified),Monrovia Unified,1307 East Longden Ave.,Arcadia,CA,91006-5501
2421,Plymouth Elementary (Monrovia Unified),Monrovia Unified,1300 Boley St.,Monrovia,CA,91016-4905
2422,Santa Fe Computer Science Magnet (Monrovia Unified),Monrovia Unified,148 West Duarte Rd.,Monrovia,CA,91016-4539
2423,Tzu Chi Elementary School- Walnut (Monrovia Unified),Monrovia Unified,1920 S. Brea Canyon Cutoff Rd,Walnut,CA,91789-3406
2424,Wild Rose School of Creative (Monrovia Unified),Monrovia Unified,232 Jasmine Ave.,Monrovia,CA,91016-2919
2425,Fremont Elementary (Montebello Unified),Montebello Unified,200 West Madison Ave.,Montebello,CA,90640-4431
2426,Garfield Elementary (Montebello Unified),Montebello Unified,7425 South Garfield Ave.,Bell Gardens,CA,90201-4815
2427,Greenwood Elementary (Montebello Unified),Montebello Unified,900 South Greenwood Ave.,Montebello,CA,90640-5816
2428,"Heritage Christian School, Bell Gardens, California (Montebello Unified)",Montebello Unified,8300 Eastern Ave,Bell Gardens,CA,90201-6115
2429,Joseph A. Gascon Elementary (Montebello Unified),Montebello Unified,630 South Leonard St.,Los Angeles,CA,90022-3508
2430,La Merced Elementary (Montebello Unified),Montebello Unified,724 North Poplar Ave.,Montebello,CA,90640-2760
2431,La Merced Intermediate (Montebello Unified),Montebello Unified,215 East Avenida de la Merced,Montebello,CA,90640-2799
2432,Macy Intermediate (Montebello Unified),Montebello Unified,2101 South Lupine Ave.,Monterey Park,CA,91755-6616
2433,Montebello Adult (Montebello Unified),Montebello Unified,2100 West Cleveland Ave.,Montebello,CA,90640-4032
2434,Montebello Christian School (Montebello Unified),Montebello Unified,136 South 7th St.,Montebello,CA,90640-4703
2435,Montebello Community Day (Montebello Unified),Montebello Unified,123 South Montebello Blvd.,Montebello,CA,90640-4729
2436,Montebello Gardens Elementary (Montebello Unified),Montebello Unified,4700 Pine St.,Pico Rivera,CA,90660-2264
2437,Montebello High (Montebello Unified),Montebello Unified,2100 West Cleveland Ave.,Montebello,CA,90640-4032
2438,Montebello Intermediate (Montebello Unified),Montebello Unified,1600 Whittier Blvd.,Montebello,CA,90640-4003
2439,Montebello Park Elementary (Montebello Unified),Montebello Unified,6300 Northside Dr.,Los Angeles,CA,90022-4619
2440,Our Lady of The Miraculous Medal (Montebello Unified),Montebello Unified,840 North Garfield Ave.,Montebello,CA,90640-1607
2441,Potrero Heights Elementary (Montebello Unified),Montebello Unified,8026 East Hill Dr.,South San Gabriel,CA,91770-4127
2442,Rosewood Park (Montebello Unified),Montebello Unified,2353 Commerce Way,City Of Commerce,CA,90040-1407
2443,Schurr Community Adult (Montebello Unified),Montebello Unified,820 North Wilcox Ave.,Montebello,CA,90640-1808
2444,Schurr High (Montebello Unified),Montebello Unified,820 North Wilcox Ave.,Montebello,CA,90640-1808
2445,St. Benedict Elementary (Montebello Unified),Montebello Unified,217 North 10th St.,Montebello,CA,90640-4604
2446,St. Gertrude School (Montebello Unified),Montebello Unified,6824 Toler Ave.,Bell Gardens,CA,90201-3210
2447,St. Thomas Aquinas School (Montebello Unified),Montebello Unified,1501 South Atlantic Blvd.,Monterey Park,CA,91754-5202
2448,Suva Elementary (Montebello Unified),Montebello Unified,6740 East Suva St.,Bell Gardens,CA,90201-1936
2449,Suva Intermediate (Montebello Unified),Montebello Unified,6660 East Suva St.,Bell Gardens,CA,90201-1943
2450,Vail High (Continuation) (Montebello Unified),Montebello Unified,1230 South Vail Ave.,Montebello,CA,90640-6312
2451,Washington Elementary (Montebello Unified),Montebello Unified,1400 West Madison Ave.,Montebello,CA,90640-4132
2452,Wilcox Elementary (Montebello Unified),Montebello Unified,816 Donna Way,Montebello,CA,90640-2322
2453,Winter Gardens Elementary (Montebello Unified),Montebello Unified,1277 South Clela Ave.,Los Angeles,CA,90022-4903
2454,Applied Technology Center (Montebello Unified),Montebello Unified,1200 West Mines Ave.,Montebello,CA,90640-5538
2455,Armenian Mesrobian School (Montebello Unified),Montebello Unified,8420 Beverly Rd.,Pico Rivera,CA,90660-2203
2456,Cantwell?Sacred Heart of Mary High School (Montebello Unified),Montebello Unified,329 North Garfield Ave.,Montebello,CA,90640-3803
2457,Cesar E. Chavez Elementary (Montebello Unified),Montebello Unified,6139 Loveland St.,Bell Gardens,CA,90201-1738
2458,Don Bosco Technical Institute (Montebello Unified),Montebello Unified,1151 San Gabriel Blvd.,Rosemead,CA,91770-4251
2459,Eastmont Intermediate (Montebello Unified),Montebello Unified,400 North Bradshawe Ave.,Montebello,CA,90640-1562
2460,Ford Park Community Adult (Montebello Unified),Montebello Unified,7800 Scout Ave.,Bell Gardens,CA,90201-5630
2461,Bandini Elementary (Montebello Unified),Montebello Unified,2318 Couts Ave.,City Of Commerce,CA,90040-1102
2462,Bell Gardens Adult (Montebello Unified),Montebello Unified,6119 Agra St.,Bell Gardens,CA,90201-1705
2463,Bell Gardens Elementary (Montebello Unified),Montebello Unified,5620 Quinn St.,Bell Gardens,CA,90201-5421
2464,Bell Gardens High (Montebello Unified),Montebello Unified,6119 Agra St.,Bell Gardens,CA,90201-1705
2465,Bell Gardens Intermediate (Montebello Unified),Montebello Unified,5841 Live Oak St.,Bell Gardens,CA,90201-4616
2466,Bella Vista Elementary (Montebello Unified),Montebello Unified,2410 Findlay Ave.,Monterey Park,CA,91754-7017
2467,Miramonte Elementary (El Monte) (Mountain View Elementary),Mountain View Elementary,10620 Schmidt Rd.,El Monte,CA,91732-2702
2468,Monte Vista Elementary (Mountain View Elementary),Mountain View Elementary,11111 Thienes Ave.,El Monte,CA,91732-4005
2469,Parkview Elementary (Mountain View Elementary),Mountain View Elementary,12044 Elliott Ave.,El Monte,CA,91732-3743
2470,Twin Lakes Elementary (Mountain View Elementary),Mountain View Elementary,3900 Gilman Rd.,El Monte,CA,91732-2515
2471,Willard F. Payne Elementary (El Monte) (Mountain View Elementary),Mountain View Elementary,2850 Mountain View Rd.,El Monte,CA,91732-3593
2472,Alfred S. Madrid Middle (Mountain View Elementary),Mountain View Elementary,3300 Gilman Rd.,El Monte,CA,91732-3226
2473,Baker Elementary (Mountain View Elementary),Mountain View Elementary,12043 Exline St.,El Monte,CA,91732-2797
2474,Charles T. Kranz Intermediate (Mountain View Elementary),Mountain View Elementary,12460 Fineview St.,El Monte,CA,91732-3930
2475,Cogswell Elementary (Mountain View Elementary),Mountain View Elementary,11050 Fineview St.,El Monte,CA,91733-2817
2476,Jerry Voorhis Elementary (Mountain View Elementary),Mountain View Elementary,3501 Durfee Ave.,El Monte,CA,91732-2911
2477,La Primaria Elementary (Mountain View Elementary),Mountain View Elementary,4220 Gilman Rd.,El Monte,CA,91732-2597
2478,Maxson Elementary (Mountain View Elementary),Mountain View Elementary,12380 Felipe St.,El Monte,CA,91732-3656
2479,Mt. San Antonio Community College,Mt. San Antonio Community College District,,,,
2480,Dr. J. Michael McGrath Elementary (Newhall),Newhall,21501 Deputy Jake Way,Newhall,CA,91321-4687
2481,Meadows Elementary (Newhall),Newhall,25577 North Fedala Rd.,Valencia,CA,91355-2536
2482,Newhall Elementary (Newhall),Newhall,24607 North Walnut St.,Newhall,CA,91321-1751
2483,Oak Hills Elementary (Newhall),Newhall,26730 Old Rock Rd.,Valencia,CA,91381-0775
2484,Old Orchard Elementary (Newhall),Newhall,25141 North Avenida Rondel,Valencia,CA,91355-3205
2485,Our Lady of Perpetual Help School (Newhall),Newhall,23225 Lyons Ave.,Santa Clarita,CA,91321-2632
2486,Peachland Avenue Elementary (Newhall),Newhall,24800 Peachland Ave.,Newhall,CA,91321-3430
2487,Pico Canyon Elementary (Newhall),Newhall,25255 Pico Canyon Rd.,Stevenson Ranch,CA,91381-1658
2488,Rise and Shine Preschool & Kindergarten (Newhall),Newhall,25222 Wiley Canyon Rd.,Newhall,CA,91321-2326
2489,Stevenson Ranch Elementary (Newhall),Newhall,25820 North Carroll Ln.,Stevenson Ranch,CA,91381-1100
2490,Valencia Valley Elementary (Newhall),Newhall,23601 Carrizo Dr.,Valencia,CA,91355-2182
2491,Wiley Canyon Elementary (Newhall),Newhall,24240 La Glorita Cir.,Newhall,CA,91321-2304
2492,Arturo Sanchez Elementary (Norwalk-La Mirada Unified),Norwalk-La Mirada Unified,11960 East 162nd St.,Norwalk,CA,90650-7228
2493,Beatitudes of our Lord Elementary (Norwalk-La Mirada Unified),Norwalk-La Mirada Unified,13021 South Santa Gertrudes Ave.,La Mirada,CA,90638-2699
2494,Corvallis Middle (Norwalk-La Mirada Unified),Norwalk-La Mirada Unified,11032 East Leffingwell Rd.,Norwalk,CA,90650-3638
2495,D. D. Johnston Elementary (Norwalk-La Mirada Unified),Norwalk-La Mirada Unified,13421 South Fairford Ave.,Norwalk,CA,90650-3630
2496,Earl E. Edmondson Elementary (Norwalk-La Mirada Unified),Norwalk-La Mirada Unified,15121 South Grayland Ave.,Norwalk,CA,90650-6627
2497,Eastwood Elementary (Norwalk-La Mirada Unified),Norwalk-La Mirada Unified,15730 Pescados Dr.,La Mirada,CA,90638-4999
2498,El Camino High (Continuation) (Norwalk-La Mirada Unified),Norwalk-La Mirada Unified,14625 Keese Dr.,Whittier,CA,90604-3119
2499,Escalona Elementary (Norwalk-La Mirada Unified),Norwalk-La Mirada Unified,15135 Escalona Rd.,La Mirada,CA,90638-4601
2500,Foster Road Elementary (Norwalk-La Mirada Unified),Norwalk-La Mirada Unified,13930 East Foster Rd.,La Mirada,CA,90638-2820
2501,Foundation Christian School (Norwalk-La Mirada Unified),Norwalk-La Mirada Unified,"14901 Adelfa Dr., Number 1840",La Mirada,CA,90637
2502,Gardenhill Elementary (Norwalk-La Mirada Unified),Norwalk-La Mirada Unified,14607 East Gardenhill Dr.,La Mirada,CA,90638-2099
2503,"Heights Christian Schools, Bluefield Campus (Norwalk-La Mirada Unified)",Norwalk-La Mirada Unified,12900 Bluefield Ave.,La Mirada,CA,90638-2315
2504,John Dolland Elementary (Norwalk-La Mirada Unified),Norwalk-La Mirada Unified,15021 South Bloomfield Ave.,Norwalk,CA,90650-6807
2505,John Foster Dulles Elementary (Norwalk-La Mirada Unified),Norwalk-La Mirada Unified,12726 Meadowgreen Rd.,La Mirada,CA,90638-2637
2506,John H. Glenn High (Norwalk-La Mirada Unified),Norwalk-La Mirada Unified,13520 Shoemaker Ave.,Norwalk,CA,90650-4521
2507,John H. Nuffer Elementary (Norwalk-La Mirada Unified),Norwalk-La Mirada Unified,14821 South Jersey Ave.,Norwalk,CA,90650-5850
2508,Joyland Preschool (Norwalk-La Mirada Unified),Norwalk-La Mirada Unified,12645 Pioneer Blvd.,Norwalk,CA,90650-2845
2509,Julia B. Morrison Elementary (Norwalk-La Mirada Unified),Norwalk-La Mirada Unified,13510 South Maidstone,Norwalk,CA,90650-3850
2510,La Mirada High (Norwalk-La Mirada Unified),Norwalk-La Mirada Unified,13520 Adelfa Dr.,La Mirada,CA,90638-3103
2511,La Pluma Elementary (Norwalk-La Mirada Unified),Norwalk-La Mirada Unified,14420 La Pluma Dr.,La Mirada,CA,90638-4029
2512,Loretta Lampton Elementary (Norwalk-La Mirada Unified),Norwalk-La Mirada Unified,14716 Elmcroft Ave.,Norwalk,CA,90650-5626
2513,Los Alisos Middle (Norwalk-La Mirada Unified),Norwalk-La Mirada Unified,14800 South Jersey Ave.,Norwalk,CA,90650-5849
