school,district,street,city,state,zip
Helen Keller Elementary (Lynwood Unified),Lynwood Unified,3521 Palm Ave.,Lynwood,CA,90262-5127
Magnolia Science Academy 4 (Magnolia Science Academy District),Magnolia Science Academy District,"11330 West Graham Pl., B-9",Los Angeles,CA,90064
Magnolia Science Academy 6 (Magnolia Science Academy District),Magnolia Science Academy District,3754 Dunn Dr.,Los Angeles,CA,90034-5805
Magnolia Science Academy 7 (Magnolia Science Academy District),Magnolia Science Academy District,18355 Roscoe Blvd.,Northridge,CA,91325-4104
Magnolia Science Academy Bell (Magnolia Science Academy District),Magnolia Science Academy District,6411 Orchard Ave.,Bell,CA,90201-1023
Aurelia Pennekamp Elementary (Manhattan Beach Unified),Manhattan Beach Unified,110 South Rowell,Manhattan Beach,CA,90266-6962
Beach Cities Learning Manhattan Beach (Manhattan Beach Unified),Manhattan Beach Unified,"1431 15th St., Bldg.s C & D",Manhattan Beach,CA,90266
Creative Kids (Manhattan Beach Unified),Manhattan Beach Unified,1203 North Sepulveda Blvd.,Manhattan Beach,CA,90266-5103
Grand View Elementary (Manhattan Beach Unified),Manhattan Beach Unified,455 24th St.,Manhattan Beach,CA,90266-4348
Manhattan Academy (Manhattan Beach Unified),Manhattan Beach Unified,1740 Manhattan Beach Blvd.,Manhattan Beach,CA,90266-6220
Manhattan Beach Middle (Manhattan Beach Unified),Manhattan Beach Unified,1501 North Redondo Ave.,Manhattan Beach,CA,90266-4214
Manhattan Beach Preschool (Manhattan Beach Unified),Manhattan Beach Unified,1431 15th St.,Manhattan Beach,CA,90266-4077
Meadows Avenue Elementary (Manhattan Beach Unified),Manhattan Beach Unified,1200 Meadows Ave.,Manhattan Beach,CA,90266-4059
Mira Costa High (Manhattan Beach Unified),Manhattan Beach Unified,1401 Artesia Blvd.,Manhattan Beach,CA,90266-6968
Montessori School of Manhattan Beach (Manhattan Beach Unified),Manhattan Beach Unified,315 South Peck Ave.,Manhattan Beach,CA,90266-6934
Opal Robinson Elementary (Manhattan Beach Unified),Manhattan Beach Unified,80 Morningside Dr.,Manhattan Beach,CA,90266-6562
Pacific Elementary (Manhattan Beach Unified),Manhattan Beach Unified,1200 Pacific Ave.,Manhattan Beach,CA,90266-4969
American Martyrs School (Manhattan Beach Unified),Manhattan Beach Unified,1701 Laurel Ave.,Manhattan Beach,CA,90266-4904
Bradoaks Elementary Science Academy (Monrovia Unified),Monrovia Unified,930 East Lemon Ave.,Monrovia,CA,91016-3076
Calvary Chapel Monrovia PSP (Monrovia Unified),Monrovia Unified,1307 S. Myrtle Ave.,MONROVIA,CA,91016-4150
Calvary Road Baptist Academy (Monrovia Unified),Monrovia Unified,319 West Olive Ave.,Monrovia,CA,91016-3339
Canyon Early Learning Center (Monrovia Unified),Monrovia Unified,1000 South Canyon Blvd.,Monrovia,CA,91016-3535
Canyon Oaks High (Monrovia Unified),Monrovia Unified,930 Royal Oaks Dr.,Monrovia,CA,91016-3735
Clifton Middle (Monrovia Unified),Monrovia Unified,226 South Ivy Ave.,Monrovia,CA,91016-2836
Excellence In Education Academy (Monrovia Unified),Monrovia Unified,2640 South Myrtle Ave. Ste. A7,Monrovia,CA,91016-8209
Immaculate Conception (Monrovia Unified),Monrovia Unified,726 South Shamrock Ave.,Monrovia,CA,91016-3653
Mayflower Elementary (Monrovia Unified),Monrovia Unified,210 North Mayflower Ave.,Monrovia,CA,91016-2008
Monroe Elementary (Monrovia Unified),Monrovia Unified,402 West Colorado Blvd.,Monrovia,CA,91016-2647
Monrovia Community Adult (Monrovia Unified),Monrovia Unified,920 South Mountain Ave.,Monrovia,CA,91016-3641
Monrovia High (Monrovia Unified),Monrovia Unified,845 West Colorado Blvd.,Monrovia,CA,91016-2517
Montessori Academy of Arcadia (Monrovia Unified),Monrovia Unified,940 W. Duarte Rd,Monrovia,CA,91016-4357
Mountain Park (Monrovia Unified),Monrovia Unified,950 South Mountain Ave.,Monrovia,CA,91016-3641
Pearl Preparatory (Monrovia Unified),Monrovia Unified,1307 East Longden Ave.,Arcadia,CA,91006-5501
Plymouth Elementary (Monrovia Unified),Monrovia Unified,1300 Boley St.,Monrovia,CA,91016-4905
Santa Fe Computer Science Magnet (Monrovia Unified),Monrovia Unified,148 West Duarte Rd.,Monrovia,CA,91016-4539
Tzu Chi Elementary School- Walnut (Monrovia Unified),Monrovia Unified,1920 S. Brea Canyon Cutoff Rd,Walnut,CA,91789-3406
Wild Rose School of Creative (Monrovia Unified),Monrovia Unified,232 Jasmine Ave.,Monrovia,CA,91016-2919
Fremont Elementary (Montebello Unified),Montebello Unified,200 West Madison Ave.,Montebello,CA,90640-4431
Garfield Elementary (Montebello Unified),Montebello Unified,7425 South Garfield Ave.,Bell Gardens,CA,90201-4815
Greenwood Elementary (Montebello Unified),Montebello Unified,900 South Greenwood Ave.,Montebello,CA,90640-5816
"Heritage Christian School, Bell Gardens, California (Montebello Unified)",Montebello Unified,8300 Eastern Ave,Bell Gardens,CA,90201-6115
Joseph A. Gascon Elementary (Montebello Unified),Montebello Unified,630 South Leonard St.,Los Angeles,CA,90022-3508
La Merced Elementary (Montebello Unified),Montebello Unified,724 North Poplar Ave.,Montebello,CA,90640-2760
La Merced Intermediate (Montebello Unified),Montebello Unified,215 East Avenida de la Merced,Montebello,CA,90640-2799
Macy Intermediate (Montebello Unified),Montebello Unified,2101 South Lupine Ave.,Monterey Park,CA,91755-6616
Montebello Adult (Montebello Unified),Montebello Unified,2100 West Cleveland Ave.,Montebello,CA,90640-4032
Montebello Christian School (Montebello Unified),Montebello Unified,136 South 7th St.,Montebello,CA,90640-4703
Montebello Community Day (Montebello Unified),Montebello Unified,123 South Montebello Blvd.,Montebello,CA,90640-4729
Montebello Gardens Elementary (Montebello Unified),Montebello Unified,4700 Pine St.,Pico Rivera,CA,90660-2264
Montebello High (Montebello Unified),Montebello Unified,2100 West Cleveland Ave.,Montebello,CA,90640-4032
Montebello Intermediate (Montebello Unified),Montebello Unified,1600 Whittier Blvd.,Montebello,CA,90640-4003
Montebello Park Elementary (Montebello Unified),Montebello Unified,6300 Northside Dr.,Los Angeles,CA,90022-4619
Our Lady of The Miraculous Medal (Montebello Unified),Montebello Unified,840 North Garfield Ave.,Montebello,CA,90640-1607
Potrero Heights Elementary (Montebello Unified),Montebello Unified,8026 East Hill Dr.,South San Gabriel,CA,91770-4127
Rosewood Park (Montebello Unified),Montebello Unified,2353 Commerce Way,City Of Commerce,CA,90040-1407
Schurr Community Adult (Montebello Unified),Montebello Unified,820 North Wilcox Ave.,Montebello,CA,90640-1808
Schurr High (Montebello Unified),Montebello Unified,820 North Wilcox Ave.,Montebello,CA,90640-1808
St. Benedict Elementary (Montebello Unified),Montebello Unified,217 North 10th St.,Montebello,CA,90640-4604
St. Gertrude School (Montebello Unified),Montebello Unified,6824 Toler Ave.,Bell Gardens,CA,90201-3210
St. Thomas Aquinas School (Montebello Unified),Montebello Unified,1501 South Atlantic Blvd.,Monterey Park,CA,91754-5202
Suva Elementary (Montebello Unified),Montebello Unified,6740 East Suva St.,Bell Gardens,CA,90201-1936
Suva Intermediate (Montebello Unified),Montebello Unified,6660 East Suva St.,Bell Gardens,CA,90201-1943
Vail High (Continuation) (Montebello Unified),Montebello Unified,1230 South Vail Ave.,Montebello,CA,90640-6312
Washington Elementary (Montebello Unified),Montebello Unified,1400 West Madison Ave.,Montebello,CA,90640-4132
Wilcox Elementary (Montebello Unified),Montebello Unified,816 Donna Way,Montebello,CA,90640-2322
Winter Gardens Elementary (Montebello Unified),Montebello Unified,1277 South Clela Ave.,Los Angeles,CA,90022-4903
Applied Technology Center (Montebello Unified),Montebello Unified,1200 West Mines Ave.,Montebello,CA,90640-5538
Armenian Mesrobian School (Montebello Unified),Montebello Unified,8420 Beverly Rd.,Pico Rivera,CA,90660-2203
Cantwell?Sacred Heart of Mary High School (Montebello Unified),Montebello Unified,329 North Garfield Ave.,Montebello,CA,90640-3803
Cesar E. Chavez Elementary (Montebello Unified),Montebello Unified,6139 Loveland St.,Bell Gardens,CA,90201-1738
Don Bosco Technical Institute (Montebello Unified),Montebello Unified,1151 San Gabriel Blvd.,Rosemead,CA,91770-4251
Eastmont Intermediate (Montebello Unified),Montebello Unified,400 North Bradshawe Ave.,Montebello,CA,90640-1562
Ford Park Community Adult (Montebello Unified),Montebello Unified,7800 Scout Ave.,Bell Gardens,CA,90201-5630
Bandini Elementary (Montebello Unified),Montebello Unified,2318 Couts Ave.,City Of Commerce,CA,90040-1102
Bell Gardens Adult (Montebello Unified),Montebello Unified,6119 Agra St.,Bell Gardens,CA,90201-1705
Bell Gardens Elementary (Montebello Unified),Montebello Unified,5620 Quinn St.,Bell Gardens,CA,90201-5421
Bell Gardens High (Montebello Unified),Montebello Unified,6119 Agra St.,Bell Gardens,CA,90201-1705
Bell Gardens Intermediate (Montebello Unified),Montebello Unified,5841 Live Oak St.,Bell Gardens,CA,90201-4616
Bella Vista Elementary (Montebello Unified),Montebello Unified,2410 Findlay Ave.,Monterey Park,CA,91754-7017
Miramonte Elementary (El Monte) (Mountain View Elementary),Mountain View Elementary,10620 Schmidt Rd.,El Monte,CA,91732-2702
Monte Vista Elementary (Mountain View Elementary),Mountain View Elementary,11111 Thienes Ave.,El Monte,CA,91732-4005
Parkview Elementary (Mountain View Elementary),Mountain View Elementary,12044 Elliott Ave.,El Monte,CA,91732-3743
Twin Lakes Elementary (Mountain View Elementary),Mountain View Elementary,3900 Gilman Rd.,El Monte,CA,91732-2515
Willard F. Payne Elementary (El Monte) (Mountain View Elementary),Mountain View Elementary,2850 Mountain View Rd.,El Monte,CA,91732-3593
Alfred S. Madrid Middle (Mountain View Elementary),Mountain View Elementary,3300 Gilman Rd.,El Monte,CA,91732-3226
Baker Elementary (Mountain View Elementary),Mountain View Elementary,12043 Exline St.,El Monte,CA,91732-2797
Charles T. Kranz Intermediate (Mountain View Elementary),Mountain View Elementary,12460 Fineview St.,El Monte,CA,91732-3930
Cogswell Elementary (Mountain View Elementary),Mountain View Elementary,11050 Fineview St.,El Monte,CA,91733-2817
Jerry Voorhis Elementary (Mountain View Elementary),Mountain View Elementary,3501 Durfee Ave.,El Monte,CA,91732-2911
La Primaria Elementary (Mountain View Elementary),Mountain View Elementary,4220 Gilman Rd.,El Monte,CA,91732-2597
Maxson Elementary (Mountain View Elementary),Mountain View Elementary,12380 Felipe St.,El Monte,CA,91732-3656
Mt. San Antonio Community College,Mt. San Antonio Community College District,,,,
Dr. J. Michael McGrath Elementary (Newhall),Newhall,21501 Deputy Jake Way,Newhall,CA,91321-4687
Meadows Elementary (Newhall),Newhall,25577 North Fedala Rd.,Valencia,CA,91355-2536
Newhall Elementary (Newhall),Newhall,24607 North Walnut St.,Newhall,CA,91321-1751
Oak Hills Elementary (Newhall),Newhall,26730 Old Rock Rd.,Valencia,CA,91381-0775
Old Orchard Elementary (Newhall),Newhall,25141 North Avenida Rondel,Valencia,CA,91355-3205
Our Lady of Perpetual Help School (Newhall),Newhall,23225 Lyons Ave.,Santa Clarita,CA,91321-2632
Peachland Avenue Elementary (Newhall),Newhall,24800 Peachland Ave.,Newhall,CA,91321-3430
Pico Canyon Elementary (Newhall),Newhall,25255 Pico Canyon Rd.,Stevenson Ranch,CA,91381-1658
Rise and Shine Preschool & Kindergarten (Newhall),Newhall,25222 Wiley Canyon Rd.,Newhall,CA,91321-2326
Stevenson Ranch Elementary (Newhall),Newhall,25820 North Carroll Ln.,Stevenson Ranch,CA,91381-1100
Valencia Valley Elementary (Newhall),Newhall,23601 Carrizo Dr.,Valencia,CA,91355-2182
Wiley Canyon Elementary (Newhall),Newhall,24240 La Glorita Cir.,Newhall,CA,91321-2304
Arturo Sanchez Elementary (Norwalk-La Mirada Unified),Norwalk-La Mirada Unified,11960 East 162nd St.,Norwalk,CA,90650-7228
Beatitudes of our Lord Elementary (Norwalk-La Mirada Unified),Norwalk-La Mirada Unified,13021 South Santa Gertrudes Ave.,La Mirada,CA,90638-2699
Corvallis Middle (Norwalk-La Mirada Unified),Norwalk-La Mirada Unified,11032 East Leffingwell Rd.,Norwalk,CA,90650-3638
D. D. Johnston Elementary (Norwalk-La Mirada Unified),Norwalk-La Mirada Unified,13421 South Fairford Ave.,Norwalk,CA,90650-3630
Earl E. Edmondson Elementary (Norwalk-La Mirada Unified),Norwalk-La Mirada Unified,15121 South Grayland Ave.,Norwalk,CA,90650-6627
Eastwood Elementary (Norwalk-La Mirada Unified),Norwalk-La Mirada Unified,15730 Pescados Dr.,La Mirada,CA,90638-4999
El Camino High (Continuation) (Norwalk-La Mirada Unified),Norwalk-La Mirada Unified,14625 Keese Dr.,Whittier,CA,90604-3119
Escalona Elementary (Norwalk-La Mirada Unified),Norwalk-La Mirada Unified,15135 Escalona Rd.,La Mirada,CA,90638-4601
Foster Road Elementary (Norwalk-La Mirada Unified),Norwalk-La Mirada Unified,13930 East Foster Rd.,La Mirada,CA,90638-2820
Foundation Christian School (Norwalk-La Mirada Unified),Norwalk-La Mirada Unified,"14901 Adelfa Dr., Number 1840",La Mirada,CA,90637
Gardenhill Elementary (Norwalk-La Mirada Unified),Norwalk-La Mirada Unified,14607 East Gardenhill Dr.,La Mirada,CA,90638-2099
"Heights Christian Schools, Bluefield Campus (Norwalk-La Mirada Unified)",Norwalk-La Mirada Unified,12900 Bluefield Ave.,La Mirada,CA,90638-2315
John Dolland Elementary (Norwalk-La Mirada Unified),Norwalk-La Mirada Unified,15021 South Bloomfield Ave.,Norwalk,CA,90650-6807
John Foster Dulles Elementary (Norwalk-La Mirada Unified),Norwalk-La Mirada Unified,12726 Meadowgreen Rd.,La Mirada,CA,90638-2637
John H. Glenn High (Norwalk-La Mirada Unified),Norwalk-La Mirada Unified,13520 Shoemaker Ave.,Norwalk,CA,90650-4521
John H. Nuffer Elementary (Norwalk-La Mirada Unified),Norwalk-La Mirada Unified,14821 South Jersey Ave.,Norwalk,CA,90650-5850
Joyland Preschool (Norwalk-La Mirada Unified),Norwalk-La Mirada Unified,12645 Pioneer Blvd.,Norwalk,CA,90650-2845
Julia B. Morrison Elementary (Norwalk-La Mirada Unified),Norwalk-La Mirada Unified,13510 South Maidstone,Norwalk,CA,90650-3850
La Mirada High (Norwalk-La Mirada Unified),Norwalk-La Mirada Unified,13520 Adelfa Dr.,La Mirada,CA,90638-3103
La Pluma Elementary (Norwalk-La Mirada Unified),Norwalk-La Mirada Unified,14420 La Pluma Dr.,La Mirada,CA,90638-4029
Loretta Lampton Elementary (Norwalk-La Mirada Unified),Norwalk-La Mirada Unified,14716 Elmcroft Ave.,Norwalk,CA,90650-5626
Los Alisos Middle (Norwalk-La Mirada Unified),Norwalk-La Mirada Unified,14800 South Jersey Ave.,Norwalk,CA,90650-5849
Nettie L. Waite Middle (Norwalk-La Mirada Unified),Norwalk-La Mirada Unified,14320 South Norwalk Blvd.,Norwalk,CA,90650-5046
New Harvest Christian (Norwalk-La Mirada Unified),Norwalk-La Mirada Unified,11364 East Imperial Hwy.,Norwalk,CA,90650-2204
New River Elementary (Norwalk-La Mirada Unified),Norwalk-La Mirada Unified,13432 South Halcourt Ave.,Norwalk,CA,90650-3562
Norwalk High (Norwalk-La Mirada Unified),Norwalk-La Mirada Unified,11356 East Leffingwell Rd.,Norwalk,CA,90650-3646
Norwalk-La Mirada Adult (Norwalk-La Mirada Unified),Norwalk-La Mirada Unified,15711 Pioneer Blvd.,Norwalk,CA,90650-5849
Pacific Ohana Academy (Norwalk-La Mirada Unified),Norwalk-La Mirada Unified,12026 Sproul St.,Norwalk,CA,90650-2930
Ramona Head Start/State Preschool (Norwalk-La Mirada Unified),Norwalk-La Mirada Unified,14616 Dinard Ave.,Norwalk,CA,90650-5110
Reginald M. Benton Middle (Norwalk-La Mirada Unified),Norwalk-La Mirada Unified,15709 East Olive Branch Rd.,La Mirada,CA,90638-2435
Saint John of God (Norwalk-La Mirada Unified),Norwalk-La Mirada Unified,13817 Pioneer Blvd.,Norwalk,CA,90650-3919
St. Linus School (Norwalk-La Mirada Unified),Norwalk-La Mirada Unified,13913 Shoemaker Ave.,Norwalk,CA,90650-4535
St. Paul of the Cross Elementary (Norwalk-La Mirada Unified),Norwalk-La Mirada Unified,14030 Foster Rd.,La Mirada,CA,90638-2805
Thomas B. Moffitt Elementary (Norwalk-La Mirada Unified),Norwalk-La Mirada Unified,13323 South Goller Ave.,Norwalk,CA,90650-3223
Anna M. Glazier Elementary (Norwalk-La Mirada Unified),Norwalk-La Mirada Unified,10932 East Excelsior Dr.,Norwalk,CA,90650-4631
Arlie F. Hutchinson Middle (Norwalk-La Mirada Unified),Norwalk-La Mirada Unified,13900 Estero Rd.,La Mirada,CA,90638-3615
Options For Youth - Simi Valley,Options For Youth District,2585 Cochran Street,Simi Valley,CA,93065
Options For Youth - Signal Hill,Options For Youth District,400 E. Willow St,Long Beach,CA,90806
Options For Youth - Pasadena,Options For Youth District,3130 E. Colorado Blvd,Pasadena,CA,91107
Options for Youth - Hawthorne,Options For Youth District,13613 Hawthorne Blvd.,Hawthorne,CA,90250
Options for Youth - Encino,Options For Youth District,17953 Ventura Blvd.,Encino,CA,91316
Options for Youth - Cudahy,Options For Youth District,7955 S. Atlantic Ave.,Cudahy,CA,90201
Options for Youth - Compton,Options For Youth District,1301 E. Rosecrans Ave. Ste. 105,Compton,CA,90211
Options For Youth - Vermont,Options For Youth District,8219 Vermont Ave,Los Angeles,CA,90044
Options For Youth District - North Long Beach,Options For Youth District,6608 Cherry Ave.,Long Beach,CA,90807
Options For Youth - Reseda,Options For Youth District,8911 Reseda Blvd.,Northridge,CA,91324
Options For Youth - Watts,Options For Youth District,638 E. El Segundo Blvd.,Los Angeles,CA,90059
Options for Youth - Bixby,Options For Youth District,3501 Atlantic Ave.,Long Beach,CA,90807
Options For Youth - Palmdale,Options For Youth District,"2140 E. Palmdale Blvd, Suites C-J",Palmdale,CA,93550
Options for Youth - Koreatown,Options For Youth District,2322 W. 3rd St.,Los Angeles,CA,90057
Options for Youth - Bellflower,Options For Youth District,10060 Rosecrans Blvd.,Bellflower,CA,90706
Options for Youth - Lancaster,Options For Youth District,116 Commerce Center Dr.,Lancaster,CA,93534
Options For Youth - City of Industry,Options For Youth District,16030 Amar Rd.,City Of Industry,CA,91744-2203
St. Mary Elementary Catholic (Palmdale Elementary),Palmdale Elementary,1600 East Ave. R-4,Palmdale,CA,93550-6182
Summerwind Elementary (Palmdale Elementary),Palmdale Elementary,39360 Summerwind Dr.,Palmdale,CA,93551-4082
Tamarisk Elementary (Palmdale Elementary),Palmdale Elementary,1843 East Ave. Q5,Palmdale,CA,93550-2218
Tumbleweed Elementary (Palmdale Elementary),Palmdale Elementary,1100 East Avenue R-4,Palmdale,CA,93550-6185
Westside Christian (Palmdale Elementary),Palmdale Elementary,40027 11th St. West,Palmdale,CA,93551-3018
Yellen Learning Center (Palmdale Elementary),Palmdale Elementary,37015 Goldenview Way,Palmdale,CA,93552-5348
Yucca Elementary (Palmdale Elementary),Palmdale Elementary,38440 Second St. East,Palmdale,CA,93550-3603
"Desert Willow Fine Arts, Science and Technology Magnet Academy (Palmdale Elementary)",Palmdale Elementary,36555 Sunny Ln.,Palmdale,CA,93550-1019
Dos Caminos Dual Immersion (Palmdale Elementary),Palmdale Elementary,39066 Palm Tree Way,Palmdale,CA,93551-3994
EIL Excellence In Learning (Palmdale Elementary),Palmdale Elementary,36509 Jenna Ln.,Palmdale,CA,93550-8383
Antelope Valley Learning Academy (Palmdale Elementary),Palmdale Elementary,37212 47th St. East,Palmdale,CA,93550-4421
Barrel Springs Elementary (Palmdale Elementary),Palmdale Elementary,3636 Ponderosa Way,Palmdale,CA,93550-8441
Space Aeronautics Gateway to Exploration Magnet Academy (Palmdale Elementary),Palmdale Elementary,38060 20th St. East,Palmdale,CA,93550-4903
Berean Fellowship Christian School (Palmdale Elementary),Palmdale Elementary,38050 30th St. East,Palmdale,CA,93550-4916
Buena Vista Elementary (Palmdale Elementary),Palmdale Elementary,37005 Hillcrest Dr.,Palmdale,CA,93552-5347
"Cactus Medical, Health and Technology Magnet Academy (Palmdale Elementary)",Palmdale Elementary,3243 East Ave. R-8,Palmdale,CA,93550-5690
Chaparral Prep Academy (Palmdale Elementary),Palmdale Elementary,37500 50th St. East,Palmdale,CA,93552-4517
Cimarron Elementary (Palmdale Elementary),Palmdale Elementary,36940 45th St. East,Palmdale,CA,93552-5201
David G. Millen Law and Government Magnet Academy (Palmdale Elementary),Palmdale Elementary,39221 22nd St. West,Palmdale,CA,93551-4082
Desert Rose Elementary (Palmdale Elementary),Palmdale Elementary,37730 27th St. East,Palmdale,CA,93550-5580
Empowered Church International/Empowered Learning Academy (Palmdale Elementary),Palmdale Elementary,"2205 E Palmdale Blvd, Ste. B",Palmdale,CA,93550-1316
Golden Poppy Elementary (Palmdale Elementary),Palmdale Elementary,37802 Rockie Ln.,Palmdale,CA,93552-4041
Innovations Academy of Palmdale (Palmdale Elementary),Palmdale Elementary,37230 37th St. East,Palmdale,CA,93550-2542
Joshua Hills Elementary (Palmdale Elementary),Palmdale Elementary,3030 Fairfield,Palmdale,CA,93550-8300
Los Amigos - Dual Immersion (Palmdale Elementary),Palmdale Elementary,6640 East Avenue R-8,Palmdale,CA,93552-3503
Manzanita Elementary (Palmdale Elementary),Palmdale Elementary,38620 33rd St.,Palmdale,CA,93550-4232
Mesquite Elementary (Palmdale Elementary),Palmdale Elementary,37622 43rd St. East,Palmdale,CA,93552-3647
Oak Tree Community Day (Palmdale Elementary),Palmdale Elementary,37230 37th St. East,Palmdale,CA,93550-2542
Ocotillo Elementary (Palmdale Elementary),Palmdale Elementary,38737 Ocotillo School Dr.,Palmdale,CA,93551
Palm Tree Elementary (Palmdale Elementary),Palmdale Elementary,326 East Avenue R,Palmdale,CA,93550-5208
Palmdale Aerospace Academy (Palmdale Elementary),Palmdale Elementary,3300 East Palmdale Blvd.,Palmdale,CA,93550-5036
Palmdale Discovery Center (Palmdale Elementary),Palmdale Elementary,39174 Palm Tree Way,Palmdale,CA,93551-3994
Palmdale Learning Plaza (Palmdale Elementary),Palmdale Elementary,38043 Division St.,Palmdale,CA,93551-3427
Quail Valley Elementary (Palmdale Elementary),Palmdale Elementary,37236 58th St. East,Palmdale,CA,93552-5461
Shadow Hills Engineering and Design Magnet Academy (Palmdale Elementary),Palmdale Elementary,37315 60th St. East,Palmdale,CA,93552-5462
Shepherd Christian School (Palmdale Elementary),Palmdale Elementary,1730 High Vista Ave.,Palmdale,CA,93550-7354
Beach Cities Learning Center-Palos Verdes (Palos Verdes Peninsula Unified),Palos Verdes Peninsula Unified,"38 Crest Rd. West Rm.s 8, 9, 10",Rolling Hills,CA,90274
Center for Learning Unlimited (Palos Verdes Peninsula Unified),Palos Verdes Peninsula Unified,"2785 PCH Ste., Ste. G",Torrance,CA,90505
Chadwick (Palos Verdes Peninsula Unified),Palos Verdes Peninsula Unified,26800 South Academy Dr.,Palos Verdes Peninsula,CA,90274-3980
Cornerstone at Pedregal Elementary (Palos Verdes Peninsula Unified),Palos Verdes Peninsula Unified,6069 Groveoak Pl.,Rancho Palos Verdes,CA,90275-2261
Dapplegray Elementary (Palos Verdes Peninsula Unified),Palos Verdes Peninsula Unified,3011 Palos Verdes Dr. North,Rolling Hills Estates,CA,90274-7303
"Fusion Academy, Palos Verdes (Palos Verdes Peninsula Unified)",Palos Verdes Peninsula Unified,"550 Deep Valley Rd., Ste. 250",Rolling Hills,CA,90274-3721
Lunada Bay Elementary (Palos Verdes Peninsula Unified),Palos Verdes Peninsula Unified,520 Paseo Lunado,Palos Verdes Estates,CA,90274-4377
Mira Catalina Elementary (Palos Verdes Peninsula Unified),Palos Verdes Peninsula Unified,30511 Lucania Dr.,Rancho Palos Verdes,CA,90275-6272
Miraleste Intermediate (Palos Verdes Peninsula Unified),Palos Verdes Peninsula Unified,29323 Palos Verdes Dr. East,Rancho Palos Verdes,CA,90275-6470
Silver Spur Elementary (Palos Verdes Peninsula Unified),Palos Verdes Peninsula Unified,5500 Ironwood St.,Rancho Palos Verdes,CA,90275-1739
Soleado Elementary (Palos Verdes Peninsula Unified),Palos Verdes Peninsula Unified,27800 Longhill Dr.,Rancho Palos Verdes,CA,90275-3909
St. John Fisher Elementary (Palos Verdes Peninsula Unified),Palos Verdes Peninsula Unified,5446 Crest Rd.,Rancho Palos Verdes,CA,90275-5027
Sunrise Pre-School (Palos Verdes Peninsula Unified),Palos Verdes Peninsula Unified,3801 Via La Selva,Palos Verdes Estates,CA,90274-1119
Vista Grande Elementary (Palos Verdes Peninsula Unified),Palos Verdes Peninsula Unified,7032 Purpleridge Dr.,Rancho Palos Verdes,CA,90275-3059
Montemalaga Elementary (Palos Verdes Peninsula Unified),Palos Verdes Peninsula Unified,1121 Via Nogales,Palos Verdes Estates,CA,90274-1671
Palos Verdes Adult (Palos Verdes Peninsula Unified),Palos Verdes Peninsula Unified,38 Crest Rd. West,Rolling Hills,CA,90274-5058
Palos Verdes High (Palos Verdes Peninsula Unified),Palos Verdes Peninsula Unified,600 Cloyden Rd.,Palos Verdes Estates,CA,90274-1869
Palos Verdes Intermediate (Palos Verdes Peninsula Unified),Palos Verdes Peninsula Unified,2161 Via Olivera,Palos Verdes Estates,CA,90274-1983
Palos Verdes Peninsula High (Palos Verdes Peninsula Unified),Palos Verdes Peninsula Unified,27118 Silver Spur Rd.,Rolling Hills Estates,CA,90274-2300
Peninsula Heritage School (Palos Verdes Peninsula Unified),Palos Verdes Peninsula Unified,26944 and 26825 Rolling Hills Rd.,Rolling Hills Estates,CA,90274
Point Vicente Elementary (Palos Verdes Peninsula Unified),Palos Verdes Peninsula Unified,30540 Rue de La Pierre,Rancho Palos Verdes,CA,90275-5364
PV Peninsula Montessori School (Palos Verdes Peninsula Unified),Palos Verdes Peninsula Unified,31100 Hawthorne Blvd.,Rancho Palos Verdes,CA,90275-5354
Rancho del Mar High (Continuation) (Palos Verdes Peninsula Unified),Palos Verdes Peninsula Unified,38 Crest Road West,Rolling Hills,CA,90274-5058
Rancho Vista Elementary (Palos Verdes Peninsula Unified),Palos Verdes Peninsula Unified,4323 Palos Verdes Dr. North,Rolling Hills Estates,CA,90274-1576
Ridgecrest Intermediate (Palos Verdes Peninsula Unified),Palos Verdes Peninsula Unified,28915 Northbay Rd.,Rancho Palos Verdes,CA,90275-4902
Rolling Hills Country Day School (Palos Verdes Peninsula Unified),Palos Verdes Peninsula Unified,26444 Crenshaw Blvd.,Rolling Hills Estates,CA,90274-2517
Para Los Ninos - Evelyn Thurman Gratts Primary (Para Los Ninos Charter District),Para Los Ninos Charter District,474 South Hartford Ave.,Los Angeles,CA,90017-1306
Para Los Ninos Charter (Para Los Ninos Charter District),Para Los Ninos Charter District,1617 East Seventh St.,Los Angeles,CA,90021-1207
Para Los Ninos Middle (Para Los Ninos Charter District),Para Los Ninos Charter District,835 Stanford Ave.,Los Angeles,CA,90021-1847
